{"key": "subject_exact_match_credit", "date": "2026-06-20", "era": "78 gold (jun20)", "disposition": "kill", "status": "discarded", "delta": 0.0, "note": "In _hydrate_item, when ALL query topic tokens appear (casefolded substring) in row['subject'], add additive RRF credit BETA*comp.rrf_score, sweep BETA in [0.05, 0.10]. Gate is strict (all tokens must be present), fires only on subjects that fully contain the query intent (e.g. a ledger fact whose subject IS the answer), and stays silent on partial chatty matches. Targets factual golds whose subject exactly names the topic but sit at rank 2-3 under longer-body conversation items. Verify regressions==0.", "commit": "", "metrics": {"quality": 0.5508, "hit_rate": 0.6034, "mrr": 0.428, "recall@10": null, "latency_p95_ms": 138.3}, "seq": 50}
{"key": "consolidation_boost_shape_gated", "date": "2026-06-20", "era": "78 gold (jun20)", "disposition": "kill", "status": "discarded", "delta": 0.0, "note": "In _fuse(), apply the cfg.consolidation_boost multiplier to a cons contribution ONLY when the query intent actually wants consolidations — i.e. when the parsed shape is synthesis. ROOT CAUSE found: prefer_consolidations defaults to True in HybridQueryConfig and route.py only ever re-affirms it for synthesis — so the 1.05 consolidation_boost fires on EVERY factual query. Multiple factual golds confirmed losing to boosted cons (troika medlemssak, medlemssak, hvem er jeg gift med, both deployment golds). Keep the boost for synthesis shape.", "commit": "", "metrics": {"quality": 0.5508, "hit_rate": 0.6034, "mrr": 0.428, "recall@10": null, "latency_p95_ms": 159.1}, "seq": 51}
{"key": "agreement_band_widen_resweep", "date": "2026-06-20", "era": "78 gold (jun20)", "disposition": "kill", "status": "discard", "delta": 0.0, "note": "Resweep DELTA∈[0.05,0.07,0.10] × THRESH∈[2,3] for rank_agreement_multiplier; best combo matched the shipped defaults (DELTA=0.05, THRESH=2); no improvement over the baseline 0.5508. DO NOT REVISIT.", "commit": "", "metrics": {"quality": 0.5508, "hit_rate": 0.6034, "mrr": 0.428, "recall@10": null, "latency_p95_ms": 162.2}, "seq": 52}
{"key": "graded_rank_agreement", "date": "2026-06-21", "era": "78 gold (jun21)", "disposition": "kill", "status": "discarded", "delta": 0.0, "note": "In _fuse() post-loop pass, replace the single binary <=2 both multiplier with a GRADED schedule (TIER1 when both<=1, current 0.05 when both<=2, TIER3 in [0.02,0.03] when both<=4). Swept TIER1 in [0.08,0.10]. Quality did not improve; graded curve did not catch additional golds vs flat step. DO NOT REVISIT.", "commit": "", "metrics": {"quality": 0.5329, "hit_rate": 0.5909, "mrr": 0.3975, "recall@10": null, "latency_p95_ms": 147.5}, "seq": 53}
{"key": "tier2_factual_coverage_recovery", "date": "2026-06-21", "era": "78 gold (jun21)", "disposition": "keep", "status": "win", "delta": 0.0487, "note": "IN _hydrate_item: additive RRF credit GAMMA/(rrf_k+fts_rank+1) for tier2 factual FTS-present/vector-absent items; GAMMA=0.5, fts_rank<=5 gate; query_shape forwarded via route.py. WIN q 0.5329->0.5816.", "commit": "", "metrics": {"quality": 0.5816, "hit_rate": 0.6364, "mrr": 0.4539, "recall@10": null, "latency_p95_ms": 167.7}, "seq": 54}
{"key": "dual_coverage_disagreement_demote", "date": "2026-06-21", "era": "78 gold (jun21)", "disposition": "kill", "status": "discarded", "delta": 0.0, "note": "In _hydrate, after the rrf_score sort, a single stable adjacent-swap pass that demotes candidate A below the next candidate B when A is SINGLE-index (exactly one of A.fts_rank / A.vector_rank is None) AND B is DUAL-coverage (both ranks present) AND abs(A.rrf-B.rrf) <= EPS*A.rrf, sweep EPS in [0.03,0.06]. Guard: skip the demote when A.source==cfg.tier2_source to protect FTS-only tier2 factual golds. Ordering-only, zero recall risk.", "commit": "", "metrics": {"quality": 0.5816, "hit_rate": 0.6364, "mrr": 0.4539, "recall@10": null, "latency_p95_ms": 220.3}, "seq": 55}
{"key": "consolidation_boost_coverage_gated", "date": "2026-06-21", "era": "78 gold (jun21)", "disposition": "kill", "status": "discarded", "delta": -0.0106, "note": "In _fuse(), apply cfg.consolidation_boost to a consolidation contribution only for the index where it actually ranks well (fts_rank<=5 or vector_rank<=5 respectively); skip the boost on the weak-ranking index contribution. Gate generously (rank<=5). 1 regression; discard.", "commit": "", "metrics": {"quality": 0.571, "hit_rate": 0.6212, "mrr": 0.4539, "recall@10": null, "latency_p95_ms": 167.9}, "seq": 56}
{"key": "thread_coherence_credit", "date": "2026-06-21", "era": "78 gold (jun21)", "disposition": "keep", "status": "win", "delta": 0.0328, "note": "In _hydrate, additive RRF credit OMEGA*top3_cons_rrf_score for atomic items sharing thread_id with a top-3 consolidation, gated to fts_rank is not None. OMEGA=0.15. WIN q 0.5816->0.6144, regressions=0, recall@10=0.9242.", "commit": "", "metrics": {"quality": 0.6144, "hit_rate": 0.6667, "mrr": 0.4924, "recall@10": 0.9242, "latency_p95_ms": 170.2}, "seq": 57}
{"key": "tier2_boost_fused_order_cap", "date": "2026-06-21", "era": "78 gold (jun21)", "disposition": "kill", "status": "win", "delta": 0.0106, "note": "REVERTED as held-out overfit (git 9dec8bf). In _hydrate, after rrf_score sort (else branch), single stable adjacent-swap pass demoting tier2 item A below next non-tier2 B when B pre-boost base rrf strictly > A pre-boost. Ordering-only. WIN q 0.6144->0.6250, regressions=0, recall@10=0.9242.", "commit": "", "metrics": {"quality": 0.625, "hit_rate": 0.6818, "mrr": 0.4924, "recall@10": 0.9242, "latency_p95_ms": 172.0}, "seq": 58}
{"key": "sole_fts_exact_over_vec_only_tiebreak", "date": "2026-06-21", "era": "78 gold (jun21)", "disposition": "kill", "status": "park", "delta": 0.0, "note": "In _hydrate, ordering-only stable adjacent-swap promoting B (sole FTS fts_rank<=1 vector_rank=None) above A (vector-only) when rrf gap <= EPS*A.rrf; EPS swept [0.02,0.04,0.06]. Targets lexical-exact atomic vs semantic-only cons at near-parity. delta=0, 0 regressions; EPS band too tight to reach any gold. PARK.", "commit": "", "metrics": {"quality": 0.625, "hit_rate": 0.6818, "mrr": 0.4924, "recall@10": null, "latency_p95_ms": 170.4}, "seq": 59}
{"key": "cons_breadth_mass_normalize", "date": "2026-06-21", "era": "78 gold (jun21)", "disposition": "kill", "status": "discarded", "delta": 0.0, "note": "In _fuse(), multiply cons contribution by 1.0 / (1.0 + LAMBDA*log1p(item_count)) to normalize sprawling multi-topic cons sessions, swept LAMBDA in [0.05,0.10,0.15]. Quality unchanged (0.625, delta=0, regressions=0). Sprawling cons breadth did not help gold ranking; normalize had no measurable effect.", "commit": "", "metrics": {"quality": 0.625, "hit_rate": 0.6818, "mrr": 0.4924, "recall@10": null, "latency_p95_ms": 169.5}, "seq": 60}
{"key": "vector_distance_margin_tiebreak", "date": "2026-06-21", "era": "78 gold (jun21)", "disposition": "kill", "status": "discarded", "delta": 0.0, "note": "In _hydrate, ordering-only stable adjacent-swap promoting B above A when BOTH have vector_distance set AND B.vector_distance <= A.vector_distance - MARGIN (B is materially closer in embedding space) AND rrf gap abs(A.rrf-B.rrf) <= EPS*A.rrf; swept MARGIN over cosine-distance units [0.03,0.05,0.08] and EPS in [0.05,0.08]. Quality unchanged (0.625, delta=0, regressions=0). Distinct from discarded vector_distance_gap_demote (round 3) which applied a multiplicative score penalty — this is a pairwise ordering swap. No gold sat inside the band at any tested MARGIN/EPS combination.", "commit": "", "metrics": {"quality": 0.625, "hit_rate": 0.6818, "mrr": 0.4924, "recall@10": null, "latency_p95_ms": 168.3}, "seq": 61}
{"key": "rerank-off (hybrid baseline)", "date": "2026-06-30", "era": "rerank sweep (jun30, full-MRR)", "disposition": "baseline", "status": "ok", "delta": null, "note": "cross-encoder rerank regresses MRR + adds 5-13s latency; opt-in stays off", "commit": "2b0cf17", "metrics": {"quality": null, "hit_rate": 0.6667, "mrr": 0.7454, "recall@10": 0.9242, "latency_p95_ms": 158.0}, "seq": 62}
{"key": "rerank-k24", "date": "2026-06-30", "era": "rerank sweep (jun30, full-MRR)", "disposition": "kill", "status": "kill", "delta": null, "note": "cross-encoder rerank regresses MRR + adds 5-13s latency; opt-in stays off", "commit": "2b0cf17", "metrics": {"quality": null, "hit_rate": 0.4091, "mrr": 0.5367, "recall@10": 0.8182, "latency_p95_ms": 13086.4}, "seq": 63}
{"key": "rerank-k36", "date": "2026-06-30", "era": "rerank sweep (jun30, full-MRR)", "disposition": "kill", "status": "kill", "delta": null, "note": "cross-encoder rerank regresses MRR + adds 5-13s latency; opt-in stays off", "commit": "2b0cf17", "metrics": {"quality": null, "hit_rate": 0.4091, "mrr": 0.5327, "recall@10": 0.803, "latency_p95_ms": 4861.2}, "seq": 64}
{"key": "rerank-k50", "date": "2026-06-30", "era": "rerank sweep (jun30, full-MRR)", "disposition": "kill", "status": "kill", "delta": null, "note": "cross-encoder rerank regresses MRR + adds 5-13s latency; opt-in stays off", "commit": "2b0cf17", "metrics": {"quality": null, "hit_rate": 0.3636, "mrr": 0.5078, "recall@10": 0.803, "latency_p95_ms": 5422.9}, "seq": 65}
{"key": "rerank-k60", "date": "2026-06-30", "era": "rerank sweep (jun30, full-MRR)", "disposition": "kill", "status": "kill", "delta": null, "note": "cross-encoder rerank regresses MRR + adds 5-13s latency; opt-in stays off", "commit": "2b0cf17", "metrics": {"quality": null, "hit_rate": 0.3636, "mrr": 0.5053, "recall@10": 0.803, "latency_p95_ms": 6378.5}, "seq": 66}
{"key": "rerank-k100", "date": "2026-06-30", "era": "rerank sweep (jun30, full-MRR)", "disposition": "kill", "status": "kill", "delta": null, "note": "cross-encoder rerank regresses MRR + adds 5-13s latency; opt-in stays off", "commit": "2b0cf17", "metrics": {"quality": null, "hit_rate": 0.3636, "mrr": 0.4991, "recall@10": 0.7727, "latency_p95_ms": 10364.2}, "seq": 67}
{"key": "baseline-anchor", "date": "", "era": "78 gold (jun21)", "disposition": "baseline", "status": "ok", "delta": null, "note": "split=dev regressions=0", "commit": "", "metrics": {"quality": 0.6144, "hit_rate": 0.6667, "mrr": 0.4924, "recall@10": 0.9242, "latency_p95_ms": 148.2}, "seq": 68}
{"key": "rerank-off (hybrid baseline)", "date": "", "era": "rerank sweep (full-MRR)", "disposition": "baseline", "status": "", "delta": null, "note": "rerank-off baseline", "commit": "", "metrics": {"quality": null, "hit_rate": 0.6667, "mrr": 0.7454, "recall@10": 0.9242, "latency_p95_ms": 170.7}, "seq": 69}
{"key": "rerank-k24", "date": "", "era": "rerank sweep (full-MRR)", "disposition": "kill", "status": "", "delta": null, "note": "cross-encoder rerank regresses; opt-in stays off", "commit": "", "metrics": {"quality": null, "hit_rate": 0.4091, "mrr": 0.5367, "recall@10": 0.8182, "latency_p95_ms": 6775.6}, "seq": 70}
{"key": "rerank-k36", "date": "", "era": "rerank sweep (full-MRR)", "disposition": "kill", "status": "", "delta": null, "note": "cross-encoder rerank regresses; opt-in stays off", "commit": "", "metrics": {"quality": null, "hit_rate": 0.4091, "mrr": 0.5327, "recall@10": 0.803, "latency_p95_ms": 5877.0}, "seq": 71}
{"key": "rerank-k50", "date": "", "era": "rerank sweep (full-MRR)", "disposition": "kill", "status": "", "delta": null, "note": "cross-encoder rerank regresses; opt-in stays off", "commit": "", "metrics": {"quality": null, "hit_rate": 0.3636, "mrr": 0.5078, "recall@10": 0.803, "latency_p95_ms": 7145.9}, "seq": 72}
{"key": "rerank-k60", "date": "", "era": "rerank sweep (full-MRR)", "disposition": "kill", "status": "", "delta": null, "note": "cross-encoder rerank regresses; opt-in stays off", "commit": "", "metrics": {"quality": null, "hit_rate": 0.3636, "mrr": 0.5053, "recall@10": 0.803, "latency_p95_ms": 7106.4}, "seq": 73}
{"key": "rerank-k100", "date": "", "era": "rerank sweep (full-MRR)", "disposition": "kill", "status": "", "delta": null, "note": "cross-encoder rerank regresses; opt-in stays off", "commit": "", "metrics": {"quality": null, "hit_rate": 0.3636, "mrr": 0.4991, "recall@10": 0.7727, "latency_p95_ms": 10720.2}, "seq": 74}
{"key": "anchor-jul01-densified", "date": "", "era": "78 gold (jun21)", "disposition": "baseline", "status": "fail:recall", "delta": null, "note": "split=dev regressions=0", "commit": "", "metrics": {"quality": 0.5739, "hit_rate": 0.6567, "mrr": 0.4931, "recall@10": 0.9104, "latency_p95_ms": 198.2}, "seq": 75}
{"key": "anchor-jul01-densified (78->79 gold, rejudge-reparse fix)", "date": "", "era": "79 gold (jul01)", "disposition": "baseline", "status": "ok", "delta": null, "note": "Fixed rejudge-misses stale-parse bug, recovered 1 net new gold (78->79). Quality drops vs 0.6144 baseline because the new gold is a former miss, hard by construction (same effect as jun19/jun21 densifications).", "commit": "073c954", "metrics": {"quality": 0.6076, "hit_rate": 0.6567, "mrr": 0.735, "recall@10": 0.9104, "latency_p95_ms": 198.2}, "seq": 76}
{"key": "baseline-check", "date": "", "era": "79 gold (jul01)", "disposition": "baseline", "status": "ok", "delta": null, "note": "split=dev regressions=0", "commit": "", "metrics": {"quality": 0.6076, "hit_rate": 0.6567, "mrr": 0.4931, "recall@10": 0.9104, "latency_p95_ms": 159.6}, "seq": 77}
{"key": "t5-synonyms", "date": "", "era": "79 gold (jul01)", "disposition": "keep", "status": "ok", "delta": null, "note": "isbad NO<->EN group; scored metrics flat vs baseline (isbad is an unscored zero-result miss the harness can't grade); quality delta is latency noise only; kept in repo templates, inert in live config until retrieve.synonyms is added there", "commit": "", "metrics": {"quality": 0.5717, "hit_rate": 0.6567, "mrr": 0.4931, "recall@10": 0.9104, "latency_p95_ms": 216.9}, "seq": 78}
{"key": "t5-synonyms-rerun", "date": "", "era": "79 gold (jul01)", "disposition": "keep", "status": "ok", "delta": null, "note": "duplicate confirm run of t5-synonyms; scored metrics identical (hit_rate/mrr/recall@10), only p95 latency varied", "commit": "", "metrics": {"quality": 0.6015, "hit_rate": 0.6567, "mrr": 0.4931, "recall@10": 0.9104, "latency_p95_ms": 230.3}, "seq": 79}
{"key": "baseline-check-t4", "date": "", "era": "79 gold (jul01)", "disposition": "baseline", "status": "ok", "delta": null, "note": "split=dev regressions=0", "commit": "", "metrics": {"quality": 0.6076, "hit_rate": 0.6567, "mrr": 0.4931, "recall@10": 0.9104, "latency_p95_ms": 156.6}, "seq": 80}
{"key": "diacritics-0", "date": "", "era": "79 gold (jul01)", "disposition": "baseline", "status": "ok", "delta": null, "note": "T4 diagnostic: frozen-fixture copy, FTS rebuilt with remove_diacritics=0 (matches the live migration). hit_rate/mrr/recall@10 identical to anchor; quality delta is p95-latency noise only, not a regression. 'var'/'vaar' stay unconflated (565 vs 2575 FTS hits) but no gold query is sensitive to that split.", "commit": "", "metrics": {"quality": 0.5805, "hit_rate": 0.6567, "mrr": 0.4931, "recall@10": 0.9104, "latency_p95_ms": 199.1}, "seq": 81}
{"key": "diacritics-2", "date": "", "era": "79 gold (jul01)", "disposition": "baseline", "status": "ok", "delta": null, "note": "T4 diagnostic: frozen-fixture copy, FTS rebuilt with remove_diacritics=2 (matches what the frozen fixture actually shipped with, pre-copy). hit_rate/mrr/recall@10 identical to diacritics-0 and anchor; quality delta is p95-latency noise only. 'var'/'vaar' conflate to one 3087-hit bucket under diac=2 vs the 565/2575 split under diac=0, but no gold query is sensitive to that collision -- no measured reason to change the live remove_diacritics=0 migration. Decision: keep remove_diacritics=0 as-is.", "commit": "", "metrics": {"quality": 0.6074, "hit_rate": 0.6567, "mrr": 0.4931, "recall@10": 0.9104, "latency_p95_ms": 199.5}, "seq": 82}
{"key": "baseline-recency2-anchor", "date": "", "era": "79 gold (jul01)", "disposition": "baseline", "status": "ok", "delta": null, "note": "split=dev regressions=0", "commit": "", "metrics": {"quality": 0.6076, "hit_rate": 0.6567, "mrr": 0.4931, "recall@10": 0.9104, "latency_p95_ms": 157.5}, "seq": 83}
{"key": "recency2-raw-t90-f0.9", "date": "", "era": "79 gold (jul01)", "disposition": "kill", "status": "fail:regression", "delta": null, "note": "split=dev regressions=4", "commit": "", "metrics": {"quality": 0.5357, "hit_rate": 0.597, "mrr": 0.3926, "recall@10": 0.8955, "latency_p95_ms": 156.8}, "seq": 84}
{"key": "baseline-post-recency2", "date": "", "era": "79 gold (jul01)", "disposition": "baseline", "status": "ok", "delta": null, "note": "split=dev regressions=0", "commit": "", "metrics": {"quality": 0.6076, "hit_rate": 0.6567, "mrr": 0.4931, "recall@10": 0.9104, "latency_p95_ms": 155.6}, "seq": 85}
{"key": "recency2-raw-t90-f0.9-void", "date": "2026-08-24", "era": "79 gold (jul01)", "disposition": "kill", "status": "void:degenerate-parameterization", "delta": null, "note": "CORRECTION to seq 84. That run did not measure recency. _recency_factor is max(floor, exp(-age/tau)) with floor=0.9, tau=90, so the floor binds for any item older than 90*ln(1/0.9)=9.49 days. The fixture's NEWEST item is 2026-06-30T20:30Z; the run was 2026-08-21, so minimum age was 52 days (exp(-52/90)=0.56). The factor was exactly 0.9 for all 70134 items - a uniform multiplier cannot reorder them. Decay skips cfg.tier2_source, so the only ranking effect was a flat 10 pct demotion of raw Tier 1 against exempt tier2_ledger rows and consolidations. The 0.6076->0.5357 drop and 4 regressions are tier demotion, not age. Recency at tau=90 on this era remains UNTESTED. Retry needs a floor that does not bind over the fixture's age range, or now pinned to the fixture's max timestamp.", "commit": "e0dbeab", "metrics": {"quality": 0.5357, "hit_rate": 0.597, "mrr": 0.3926, "recall@10": 0.8955, "latency_p95_ms": 156.8}, "seq": 86}
{"key": "lane-anchor", "date": "", "era": "79 gold (jul01)", "disposition": "baseline", "status": "fail:regression", "delta": null, "note": "split=dev regressions=1", "commit": "", "metrics": {"quality": 0.5933, "hit_rate": 0.6418, "mrr": 0.4991, "recall@10": 0.9104, "latency_p95_ms": 164.4}, "seq": 87}
{"key": "recency-lane-60d", "date": "", "era": "79 gold (jul01)", "disposition": "kill", "status": "fail:regression", "delta": null, "note": "split=dev regressions=19", "commit": "", "metrics": {"quality": 0.3373, "hit_rate": 0.3731, "mrr": 0.3295, "recall@10": 0.7015, "latency_p95_ms": 201.7}, "seq": 88}
{"key": "lane-anchor-restore", "date": "", "era": "79 gold (jul01)", "disposition": "baseline", "status": "fail:regression", "delta": null, "note": "split=dev regressions=1", "commit": "", "metrics": {"quality": 0.599, "hit_rate": 0.6418, "mrr": 0.4991, "recall@10": 0.9104, "latency_p95_ms": 164.1}, "seq": 89}
{"key": "lane-anchor-qts", "date": "", "era": "79 gold (jul01)", "disposition": "baseline", "status": "ok", "delta": null, "note": "split=dev regressions=0", "commit": "", "metrics": {"quality": 0.599, "hit_rate": 0.6418, "mrr": 0.4991, "recall@10": 0.9104, "latency_p95_ms": 163.1}, "seq": 90}
{"key": "junk-3cat-off", "date": "", "era": "79 gold (jul01)", "disposition": "kill", "status": "ok", "delta": null, "note": "split=dev regressions=0", "commit": "", "metrics": {"quality": 0.599, "hit_rate": 0.6418, "mrr": 0.4991, "recall@10": 0.9104, "latency_p95_ms": 163.1}, "seq": 91}
{"key": "junk-3cat-on", "date": "", "era": "79 gold (jul01)", "disposition": "kill", "status": "fail:regression", "delta": null, "note": "split=dev regressions=3", "commit": "", "metrics": {"quality": 0.5442, "hit_rate": 0.597, "mrr": 0.4209, "recall@10": 0.8955, "latency_p95_ms": 160.5}, "seq": 92}
{"key": "junk-3cat-off-cleangold", "date": "", "era": "79 gold (jul01)", "disposition": "kill", "status": "ok", "delta": null, "note": "split=dev regressions=0", "commit": "", "metrics": {"quality": 0.5892, "hit_rate": 0.6364, "mrr": 0.479, "recall@10": 0.9091, "latency_p95_ms": 158.3}, "seq": 93}
{"key": "junk-3cat-on-cleangold", "date": "", "era": "79 gold (jul01)", "disposition": "kill", "status": "fail:regression", "delta": null, "note": "split=dev regressions=2", "commit": "", "metrics": {"quality": 0.5318, "hit_rate": 0.6061, "mrr": 0.4377, "recall@10": 0.9091, "latency_p95_ms": 195.8}, "seq": 94}
{"key": "junk-curated-off", "date": "", "era": "79 gold (jul01)", "disposition": "kill", "status": "fail:regression", "delta": null, "note": "split=dev regressions=18", "commit": "", "metrics": {"quality": 0.4963, "hit_rate": 0.5789, "mrr": 0.4129, "recall@10": 0.9211, "latency_p95_ms": 260.2}, "seq": 95}
{"key": "junk-curated-on", "date": "", "era": "79 gold (jul01)", "disposition": "kill", "status": "ok", "delta": null, "note": "split=dev regressions=0", "commit": "", "metrics": {"quality": 0.5283, "hit_rate": 0.5789, "mrr": 0.4102, "recall@10": 0.9211, "latency_p95_ms": 231.2}, "seq": 96}
{"key": "era2-anchor-nojunk", "date": "", "era": "42 gold curated (sep17)", "disposition": "baseline", "status": "ok", "delta": null, "note": "split=dev regressions=0", "commit": "", "metrics": {"quality": 0.5283, "hit_rate": 0.5789, "mrr": 0.4102, "recall@10": 0.9211, "latency_p95_ms": 343.5}, "seq": 97}
{"key": "era2-anchor-plain", "date": "", "era": "42 gold curated (sep17)", "disposition": "baseline", "status": "ok", "delta": null, "note": "split=dev regressions=0", "commit": "", "metrics": {"quality": 0.5291, "hit_rate": 0.5789, "mrr": 0.4129, "recall@10": 0.9211, "latency_p95_ms": 286.5}, "seq": 98}
{"key": "mcp_answer_budget_2000", "date": "", "era": "42 gold curated (sep17)", "disposition": "kill", "status": "", "delta": null, "note": "MCP answer token budget 2000: gold-in-context 20/38 vs 21/38 at budget 0; era-2 fixture, limit=5; shipped default off (gold-in-context 0.526, not harness hit_rate; metric nulled)", "commit": "", "metrics": {"quality": null, "hit_rate": null, "mrr": null, "recall@10": null, "latency_p95_ms": null}, "seq": 99}
