{"key": "entity_promote", "date": "", "era": "42 gold curated (sep17)", "disposition": "kill", "status": "probe", "delta": -0.0386, "note": "Entity gap (v3.1 option B): the parse prompt shows only the top-40 of ~20k entities, so long-tail names (Fredrik Nordmoen) become topic terms; and linking is content-NER only, so messages FROM/TO a person are unlinked (fixture: Nordmoen 19 linked of 548 participant/mention items). Harness --promote-entities (exact 2-4 word dictionary names in the query -> entities) on the stock fixture: dev 0.4897, 2 rank-1 regressions ('Fredrik Nordmoen' 1 -> missing): the hard entity filter restricts to the 19 linked items. Promotion is harmful without link coverage.", "commit": "", "metrics": {"quality": 0.4897, "hit_rate": 0.5263, "mrr": 0.6446, "recall@10": 0.8947, "latency_p95_ms": 245.4}, "seq": 131}
{"key": "entity_participants", "date": "", "era": "42 gold curated (sep17)", "disposition": "kill", "status": "probe", "delta": 0.0, "note": "Entity gap (v3.1 option B): the parse prompt shows only the top-40 of ~20k entities, so long-tail names (Fredrik Nordmoen) become topic terms; and linking is content-NER only, so messages FROM/TO a person are unlinked (fixture: Nordmoen 19 linked of 548 participant/mention items). scripts/link_participants.py on a fixture copy (+110,789 participant links on 54,765 items, dictionary aliases incl. emails/phones): dev 0.5283, identical to anchor (no gold query carries a person entity without promotion).", "commit": "", "metrics": {"quality": 0.5283, "hit_rate": 0.5789, "mrr": 0.6937, "recall@10": 0.9211, "latency_p95_ms": 270.0}, "seq": 132}
{"key": "entity_both", "date": "", "era": "42 gold curated (sep17)", "disposition": "kill", "status": "probe", "delta": 0.0013, "note": "Entity gap (v3.1 option B): the parse prompt shows only the top-40 of ~20k entities, so long-tail names (Fredrik Nordmoen) become topic terms; and linking is content-NER only, so messages FROM/TO a person are unlinked (fixture: Nordmoen 19 linked of 548 participant/mention items). Participant links + promotion: dev 0.5296 (+0.0013), 0 rank-1 regressions, 2 golds 7 -> 6. Safe and slightly positive but under the +0.01 keep bar; the gold set has only 4 person-name queries of 38, so it cannot show the effect.", "commit": "", "metrics": {"quality": 0.5296, "hit_rate": 0.5789, "mrr": 0.6949, "recall@10": 0.9211, "latency_p95_ms": 217.6}, "seq": 133}
{"key": "entity_occbrowse", "date": "", "era": "42 gold curated (sep17)", "disposition": "kill", "status": "probe", "delta": 0.0, "note": "Occurrence lane (HybridQueryConfig.occurrence_browse): entity/participant allowlists only post-filter a text-retrieved pool, so for 'when did I last speak with X' the newest X items (which share no words with the query) never become candidates. The lane appends the top_k allowlisted items nearest the sort end (newest for desc) for timestamp-sorted queries and exempts them from the relevance floor. Lane alone on the stock fixture: dev 0.5283, identical to anchor, 0 rank-1 regressions (one gold 26 -> out of 50). Last-contact eval (scripts/last_contact_eval.py, 44 cases/22 people): hit@1 0.0 alone, the lane needs participant links + name promotion to have an allowlist.", "commit": "", "metrics": {"quality": 0.5283, "hit_rate": 0.5789, "mrr": 0.6927, "recall@10": 0.9211, "latency_p95_ms": 278.5}, "seq": 134}
{"key": "entity_both_occbrowse", "date": "", "era": "42 gold curated (sep17)", "disposition": "kill", "status": "probe", "delta": 0.0013, "note": "Participant links + name promotion + occurrence lane. Gold dev 0.5296 (+0.0013), 0 rank-1 regressions; test 0.5083 identical to anchor, 0 moves. Under the +0.01 gold keep bar because the gold set has 4 person-name queries of 38. On the targeted last-contact eval (44 cases, 22 people, EN+NB, answer = items of the latest direct conversation): hit@1 0.045 -> 0.591, hit@5 0.045 -> 0.636, MRR 0.045 -> 0.616; a further 0.136 have a newer item linked to the person at top-1 (a note/meeting mentioning them, arguably right). Every piece alone stays <= 0.14. Ship candidate pending owner approval for live participant backfill.", "commit": "", "metrics": {"quality": 0.5296, "hit_rate": 0.5789, "mrr": 0.6939, "recall@10": 0.9211, "latency_p95_ms": 281.9}, "seq": 135}
{"key": "entity_both_occbrowse_v2", "date": "", "era": "42 gold curated (sep17)", "disposition": "kill", "status": "probe", "delta": 0.0013, "note": "Corrects seq 135. The last-contact eval leaked: replay rows had until=None, so items dated after the ask counted (newer_link@1 0.14 was that leak), and the occurrence lane skipped consolidated items without browsing their consolidations (the 6 people at rank None were exactly the 6 whose last conversation is fully consolidated). Fixes: eval until=ask, a consolidation containing the answer counts; lane also browses allowlisted consolidations. Last-contact hit@1: stock 0.068, participants+promote 0.114, all three 0.818 (hit@5 0.818, MRR 0.818), every partial stack <= 0.18. Remaining 8 misses = 1 Teams group burst the owner only received: consolidations.participants lists senders only, so the participant filter drops it. Gold dev 0.5296 (+0.0013, 0 rank-1 regressions), test 0.5083 identical.", "commit": "", "metrics": {"quality": 0.5296, "hit_rate": 0.5789, "mrr": 0.6939, "recall@10": 0.9211, "latency_p95_ms": 287.4}, "seq": 136}
{"key": "entity_lastcontact_ship", "date": "", "era": "42 gold curated (sep17)", "disposition": "keep", "status": "shipped", "delta": 0.0013, "note": "Owner shipped on the targeted eval (keep rule waived: the gold set cannot see person recall, P7). Production now: participant links on every ingest + live backfill, name promotion inside parse_query, occurrence lane on by default but only with an entity filter (a participant filter alone listed the owner's newest messages on any topic; the guard also removed the one gold move 26 -> out). Measured on fixture_participants.db with --promote-entities: last-contact hit@1 0.818 (stock 0.068); gold dev 0.5296, 2 golds 7 -> 6, 0 rank-1 regressions; lane alone on the stock fixture identical to anchor on dev and test; test 0.5083 identical. p95 ~200 -> ~320-370 ms with promotion.", "commit": "", "metrics": {"quality": 0.5296, "hit_rate": 0.5789, "mrr": 0.6949, "recall@10": 0.9211, "latency_p95_ms": 319.5}, "seq": 137}
{"key": "entity_lastcontact_review", "date": "", "era": "42 gold curated (sep17)", "disposition": "keep", "status": "shipped", "delta": 0.0013, "note": "Copilot (medium) review fixes on top of seq 137: lane only for topic-free first/last entity questions (route.CONTACT_WORDS), promotion only for curated entities + participant-linked people (NER orgs/places are phrases), canonical beats alias and shared aliases dropped in both lookups, retag keeps participant links, sender_filter in the lane SQL, gold protection in every junk rule, junk pass timeout/deadline, optional passes never abort ingest. Measured on a fresh fixture copy seeded with the current dictionary and linked by the library (+104,755 links): last-contact hit@1 0.773 (34/44; stock 0.068). The one lost person vs seq 136 is a duplicate entity (Martin Pettersen aliases Ole Martin Pettersen, which is also its own canonical): canonical-first now links the message to Ole Martin Pettersen; fix is an entity merge. Gold dev 0.5296, moves 7->6 x2 and 2->3, 0 rank-1 regressions; test 0.5083 identical.", "commit": "", "metrics": {"quality": 0.5296, "hit_rate": 0.5789, "mrr": 0.6905, "recall@10": 0.9211, "latency_p95_ms": 183.0}, "seq": 138}
{"key": "ledger_statement_dedup", "date": "", "era": "42 gold curated (sep17)", "disposition": "kill", "status": "fail:regression", "delta": -0.023, "note": "paired fixture copies, both re-embedded; dev quality 0.5283->0.5053, rank1 22->21, recall@10 0.921->0.895; test identical (4 golds, 0 tier2). Whole delta is one gold: bare-surname query 'damsleth' -> id__personal_profile rank 1 -> out of top-k (doubled statement was its BM25 TF). tier2_coverage firing 9->8. Low power: 4 tier2 golds in dev. Doubling kept on purpose; revisit at era 3 with >=10 tier2 golds.", "commit": "", "metrics": {"quality": 0.5053, "hit_rate": 0.5526, "mrr": 0.663, "recall@10": 0.8947, "latency_p95_ms": null}, "seq": 139}
{"key": "entity_lastcontact_participation", "date": "", "era": "42 gold curated (sep17)", "disposition": "keep", "status": "shipped", "delta": 0.0013, "note": "Live smoke after the 142,277-link live backfill: 'når snakket jeg sist med Jan Lindset?' returned today's meeting note (dictionary mention via the one-word alias 'Jan') and then July Teams posts reached through mention links. Fix: for an entity with participant links, the lane and the whole result set use participant links only (orgs/projects keep every link). Live: Jan -> 2026-06-01 group chat with him and the owner (own message to him at rank 3), Anne Hjort -> the 2026-05-23 iMessage thread. Fixture: last-contact 0.773 unchanged (answers are participant items), gold dev 0.5296 and test 0.5083 unchanged, 0 rank-1 regressions.", "commit": "", "metrics": {"quality": 0.5296, "hit_rate": 0.5789, "mrr": 0.6905, "recall@10": 0.9211, "latency_p95_ms": 202.8}, "seq": 140}
{"key": "participant_cons_via_items", "date": "", "era": "42 gold curated (sep17)", "disposition": "keep", "status": "", "delta": 0.0013, "note": "consolidations.participants lists senders only, so the owner-participation filter (first/last shapes) dropped consolidated threads the owner only received; their raw items are hidden behind the consolidation, so they were unreachable. _resolve_participant_allowlist now also matches a consolidation through its raw_item_ids. Last-contact (fixture copy seeded+linked like live) hit@1 0.773 -> 0.955; the 2 remaining misses are the Martin Pettersen duplicate entity, merged on live. Gold dev 0.5296 (anchor 0.5283, mrr 0.6937 -> 0.6933), 0 rank-1 regressions; test 0.5083 identical. Live: all 2,582 consolidations now match the owner; scan 6-22 ms.", "commit": "", "metrics": {"quality": 0.5296, "hit_rate": 0.5789, "mrr": 0.6902, "recall@10": 0.9211, "latency_p95_ms": 247.9}, "seq": 141}
{"key": "occurrence_contact_verbs", "date": "", "era": "42 gold curated (sep17)", "disposition": "keep", "status": "", "delta": 0.0013, "note": "New first-contact eval (scripts/last_contact_eval.py build --kind first: earliest direct conversation, asked at the corpus edge; 52 cases, 26 people, EN+NB, fixture copy seeded+linked like live). With participation scoped to 'last' only, first-contact hit@1 0.846, hit@5 1.0, and 15% of top-1s were older mention links. route now sets occurrence_contact from the question's verb: contact (speak/talk/meet/snakke/møte, either direction) uses participant links, hearsay (hear/mention/høre/nevnt) keeps mentions. First-contact hit@1 0.846 -> 1.0; last-contact 0.955 unchanged; gold dev 0.5296 / test 0.5083 unchanged, 0 rank-1 regressions. Live: 'first hear about Jan Lindset' -> 2023-12-27 note, 'first speak with' -> 2025-05-12 Teams.", "commit": "", "metrics": {"quality": 0.5296, "hit_rate": 0.5789, "mrr": 0.6902, "recall@10": 0.9211, "latency_p95_ms": 263.7}, "seq": 142}
{"key": "era3-anchor-nojunk", "date": "", "era": "42 gold curated + participant links (oct06)", "disposition": "baseline", "status": "ok", "delta": null, "note": "split=dev regressions=0", "commit": "", "metrics": {"quality": 0.5296, "hit_rate": 0.5789, "mrr": 0.4145, "recall@10": 0.9211, "latency_p95_ms": 234.3}, "seq": 143}
{"key": "era3-anchor-nojunk", "date": "", "era": "42 gold curated + participant links (oct06)", "disposition": "baseline", "status": "ok", "delta": null, "note": "split=test regressions=0", "commit": "", "metrics": {"quality": 0.5083, "hit_rate": 0.5, "mrr": 0.5278, "recall@10": 0.75, "latency_p95_ms": 196.3}, "seq": 144}
{"key": "era3-anchor-nojunk-askcutoff", "date": "", "era": "42 gold curated + participant links (oct06)", "disposition": "baseline", "status": "ok", "delta": null, "note": "split=dev regressions=0", "commit": "", "metrics": {"quality": 0.5294, "hit_rate": 0.5526, "mrr": 0.4751, "recall@10": 0.9211, "latency_p95_ms": 264.2}, "seq": 145}
{"key": "era3-anchor-nojunk-askcutoff", "date": "", "era": "42 gold curated + participant links (oct06)", "disposition": "baseline", "status": "ok", "delta": null, "note": "split=test regressions=0", "commit": "", "metrics": {"quality": 0.5083, "hit_rate": 0.5, "mrr": 0.5278, "recall@10": 0.75, "latency_p95_ms": 1055.0}, "seq": 146}
{"key": "era3-anchor-nojunk-askcutoff", "date": "", "era": "42 gold curated + participant links (oct06)", "disposition": "baseline", "status": "ok", "delta": null, "note": "split=test regressions=0", "commit": "", "metrics": {"quality": 0.5083, "hit_rate": 0.5, "mrr": 0.5278, "recall@10": 0.75, "latency_p95_ms": 943.8}, "seq": 147}
{"key": "contact_conversation_rule", "date": "", "era": "42 gold curated + participant links (oct06)", "disposition": "keep", "status": "", "delta": -0.0002, "note": "Fallback parse recognizes first/last questions (10% of live queries fall back; harness regenerates stored fallback parses). Harness replays first/last on the corpus as of the ask (the Fredrik Nordmoen golds ranked items from 06-23 for a 05-28 question). 'Speaking with' = conversation_items: 1:1 to the other party, or the other answered in the same thread within 2 h (a 12 h window let a 24-person duty group count); eval answer keys use the same function. identity.self in the live config lacked kim@damsleth.com, Carl.Joakim.Damsleth@norconsult.com, carl.joakim.damsleth@puzzlepart.com (owner participation filter dropped all Norconsult items); added. 'for' joins CONTACT_WORDS (NB 'for første gang'). Contact eval v5 (18+18): last/first hit@1 1.0 with LLM and fallback parse (fallback first was 0.63). Gold dev 0.5294 vs 0.5296: one rank-1 regression is a mislabeled gold ('last speak with Fredrik' asked 05-28 labelled with a 02-07 chat; 1:1 chats on 04-20/25/27 precede it); test identical. Re-anchored era3-anchor-nojunk-askcutoff.", "commit": "", "metrics": {"quality": 0.5294, "hit_rate": 0.5526, "mrr": 0.6843, "recall@10": 0.9211, "latency_p95_ms": 261.0}, "seq": 148}
{"key": "era4-anchor-nojunk", "date": "", "era": "47 gold live freeze (oct07)", "disposition": "baseline", "status": "ok", "delta": null, "note": "split=dev regressions=0", "commit": "", "metrics": {"quality": 0.5473, "hit_rate": 0.5476, "mrr": 0.5466, "recall@10": 0.9286, "latency_p95_ms": 356.8}, "seq": 149}
{"key": "era4-anchor-nojunk", "date": "", "era": "47 gold live freeze (oct07)", "disposition": "baseline", "status": "ok", "delta": null, "note": "split=test regressions=0", "commit": "", "metrics": {"quality": 0.1854, "hit_rate": 0.2, "mrr": 0.1513, "recall@10": 0.8, "latency_p95_ms": 376.5}, "seq": 150}
{"key": "promote_drops_snapped_entity", "date": "", "era": "47 gold live freeze (oct07)", "disposition": "keep", "status": "", "delta": 0.0, "note": "Era 4 fixture (live backup-API snapshot 2026-10-07, 47 gold incl. owner corrections 208-210: 'last speak with Fredrik Nordmoen' -> 16 May 1:1 chat, absent from the era-3 fixture). Contact eval rebuilt (14+14). First-contact LLM parse 0.857: the parser snapped 'Øystein Røvde' to entity 'Øistein' (another person) next to the promoted name. promote_entities now drops an LLM entity absent from the question that is a near-spelling (SequenceMatcher >= 0.8) of a promoted name's word. First-contact 1.0 with LLM and fallback parse, last 1.0 both; gold dev 0.5473 unchanged, 0 rank-1 regressions.", "commit": "", "metrics": {"quality": 0.5473, "hit_rate": null, "mrr": null, "recall@10": 0.9286, "latency_p95_ms": null}, "seq": 151}
{"key": "single_word_curated_promotion", "date": "", "era": "47 gold live freeze (oct07)", "disposition": "kill", "status": "probe", "delta": null, "note": "Promote curated single-word projects/teams and 4+ letter all-caps acronyms (NOCOS, IKOMM) like multi-word names. All-split era 4: 'when did I first hear about NOCOS' 42 -> 1, but 4 rank-1 golds lost (3 to no result) and 'NOCOS provisjonering incident kode' 7 -> none: promotion is a hard entity filter, and one-word project names occur in documents that are not entity-tagged. Killed. Curated one-word orgs/places are also noisy (first names typed as org, 'Hjemme', 'Verktøy', 'PS', 'HR').", "commit": "", "metrics": {"quality": 0.4598, "hit_rate": null, "mrr": null, "recall@10": 0.8511, "latency_p95_ms": null}, "seq": 152}
{"key": "fallback_parse_dates", "date": "", "era": "47 gold live freeze (oct07)", "disposition": "kill", "status": "probe", "delta": null, "note": "Fallback parser reads one explicit day (ISO, 'D month YYYY' en/nb) into date_range + temporal_range. All-split era 4: no gold moves (the one fallback date gold, 'what did i do at work 2025-05-19?', stays rank 2 with the window applied); only 1 of 79 live fallback queries contains a date. Not worth the code; killed. The fallback's occurrence rule (seq 148) stays, it carried real queries.", "commit": "", "metrics": {"quality": 0.5045, "hit_rate": null, "mrr": null, "recall@10": 0.9149, "latency_p95_ms": null}, "seq": 153}
{"key": "occurrence_needs_text", "date": "", "era": "47 gold live freeze (oct07)", "disposition": "keep", "status": "", "delta": 0.0, "note": "Timestamp-sorted queries drop vector-only candidates once FTS matched anything (lane items exempt; no FTS match keeps the vector pool). 'when did I first hear about NOCOS' ranked 42: the 41 above were imessage/teams consolidations from 2025 with no 'nocos' in the text, vector neighbours that won the asc sort on age. Era 4 dev: quality 0.5473 unchanged, recall@10 0.929 -> 0.952, NOCOS 42 -> 2, 'did v0.21 release april 2026' 19 -> 7; test 0.1854 -> 0.1989, recall@10 0.8 -> 1.0; 0 rank-1 regressions; contact eval 1.0/1.0. NOCOS rank 1 is the owner's own 2026-01-26 message with the DID project link 'NC NOCOS' (owner's earliest note is 2026-04-28; gold is the 04-27 kickoff) - label question for the owner.", "commit": "", "metrics": {"quality": 0.5473, "hit_rate": null, "mrr": null, "recall@10": 0.9524, "latency_p95_ms": 343.1}, "seq": 154}
{"key": "era4r-anchor-nojunk", "date": "", "era": "47 gold live freeze (oct07), NOCOS relabel", "disposition": "baseline", "status": "ok", "delta": null, "note": "split=dev regressions=0", "commit": "", "metrics": {"quality": 0.5745, "hit_rate": 0.5714, "mrr": 0.5815, "recall@10": 0.9524, "latency_p95_ms": 359.5}, "seq": 155}
{"key": "era4r-anchor-nojunk", "date": "", "era": "47 gold live freeze (oct07), NOCOS relabel", "disposition": "baseline", "status": "ok", "delta": null, "note": "split=test regressions=0", "commit": "", "metrics": {"quality": 0.1989, "hit_rate": 0.2, "mrr": 0.1964, "recall@10": 1.0, "latency_p95_ms": 277.4}, "seq": 156}
{"key": "era4r2-anchor-nojunk", "date": "", "era": "46 gold live freeze (oct07), relabels NOCOS + Emilie", "disposition": "baseline", "status": "ok", "delta": null, "note": "split=dev regressions=0", "commit": "", "metrics": {"quality": 0.5842, "hit_rate": 0.5854, "mrr": 0.5815, "recall@10": 0.9756, "latency_p95_ms": 353.9}, "seq": 157}
{"key": "era4r2-anchor-nojunk", "date": "", "era": "46 gold live freeze (oct07), relabels NOCOS + Emilie", "disposition": "baseline", "status": "ok", "delta": null, "note": "split=test regressions=0", "commit": "", "metrics": {"quality": 0.1989, "hit_rate": 0.2, "mrr": 0.1964, "recall@10": 1.0, "latency_p95_ms": 236.1}, "seq": 158}
