{"key": "jev_a1_junk_en", "date": "", "era": "42 gold curated (sep17)", "disposition": "kill", "status": "pending-owner-sheet", "delta": null, "note": "Not a retrieval-fitness run. Jev noul junk vs Sonnet on 24,495 10-39 char chat rows, en rubric: kappa@0.5 vs consensus 0.651 (best tau 0.63: 0.702); Sonnet run1-vs-run2 0.559; like-for-like Jev vs run1/run2 all rows 0.504/0.559. Reliability monotonic, ECE 0.137. lang kappa en 0.702 / nb 0.580 (gap 0.122). Owner junk golds 2/32 >= 0.5. $0.092, p95 1.2 s/request. Verdict waits on the owner disagreement sheet.", "commit": "ef4fb1b", "metrics": {"quality": null, "hit_rate": null, "mrr": null, "recall@10": null, "latency_p95_ms": null}, "seq": 100}
{"key": "jev_a1_junk_nb", "date": "", "era": "42 gold curated (sep17)", "disposition": "kill", "status": "pending-owner-sheet", "delta": null, "note": "Not a retrieval-fitness run. Same rows, Bokmal rubric (the better variant): kappa@0.5 vs consensus 0.674 (best tau 0.64: 0.706); Sonnet self 0.559; like-for-like Jev vs run1/run2 0.515/0.578. Reliability monotonic, ECE 0.127, over-predicts JUNK in 0.5-0.7. lang kappa en 0.721 / nb 0.608 (gap 0.113 < 0.15). Owner junk golds 2/32 >= 0.5. $0.092. Kappa + calibration gates pass; owner sheet (a1_disagreements.tsv) pending.", "commit": "ef4fb1b", "metrics": {"quality": null, "hit_rate": null, "mrr": null, "recall@10": null, "latency_p95_ms": null}, "seq": 101}
{"key": "jev_a1_junk_nb", "date": "", "era": "42 gold curated (sep17)", "disposition": "kill", "status": "pass", "delta": null, "note": "Final (owner tiebreak): owner labelled 49/50 disagreements JUNK; sides with Jev 26/50 (Jev-JUNK/Sonnet-KEEP 25/25 Jev, Jev-KEEP/Sonnet-JUNK 24/25 Sonnet); en 13/26, nb 13/24. All 3 pre-registered conditions pass (kappa 0.674 vs 0.559, monotonic, ECE 0.127; owner >= 50%). Not a retrieval-fitness run. Each judge is right when it says JUNK: owner bar is stricter than both; union-of-JUNK beats consensus.", "commit": "ef4fb1b", "metrics": {"quality": null, "hit_rate": null, "mrr": null, "recall@10": null, "latency_p95_ms": null}, "seq": 102}
{"key": "jev_b2_replace_cold", "date": "", "era": "42 gold curated (sep17)", "disposition": "kill", "status": "ok", "delta": -0.2475, "note": "B2 dev, +nojunk, jev-k 50, rel-1. vs anchor 0.5283: delta -0.2475. moves up 6 / down 24, >=5->top3 3, rank1 regr 17, new rank1 4. cold (YAAMS_JEV_NO_CACHE=1) p95 1407.9 ms vs ~690 ms latency gate; cross-encoder-style control, loses as expected", "commit": "", "metrics": {"quality": 0.2808, "hit_rate": 0.2368, "mrr": 0.3835, "recall@10": 0.7632, "latency_p95_ms": 1407.9}, "seq": 103}
{"key": "jev_b2_replace", "date": "", "era": "42 gold curated (sep17)", "disposition": "kill", "status": "ok", "delta": -0.2775, "note": "B2 dev, +nojunk, jev-k 50, rel-1. vs anchor 0.5283: delta -0.2775. moves up 5 / down 25, >=5->top3 4, rank1 regr 17, new rank1 3. cached rerun of replace; differs from cold by 0.03 quality = Jev scoring noise across calls", "commit": "", "metrics": {"quality": 0.2508, "hit_rate": 0.2105, "mrr": 0.3449, "recall@10": 0.7895, "latency_p95_ms": 1487.8}, "seq": 104}
{"key": "jev_b2_blend0.5", "date": "", "era": "42 gold curated (sep17)", "disposition": "kill", "status": "ok", "delta": 0.0183, "note": "B2 dev, +nojunk, jev-k 50, rel-1. vs anchor 0.5283: delta +0.0183. moves up 7 / down 2, >=5->top3 0, rank1 regr 2, new rank1 2. best variant but 2 rank-1 regressions (NOCOS onboarding 1->2, NOCOS standup 1->3) offset 2 new rank-1s; 0 golds >=5 -> top3; fails keep rule", "commit": "", "metrics": {"quality": 0.5466, "hit_rate": 0.5789, "mrr": 0.4712, "recall@10": 0.9211, "latency_p95_ms": 743.1}, "seq": 105}
{"key": "jev_b2_blend1.0", "date": "", "era": "42 gold curated (sep17)", "disposition": "kill", "status": "ok", "delta": 0.014, "note": "B2 dev, +nojunk, jev-k 50, rel-1. vs anchor 0.5283: delta +0.0140. moves up 7 / down 3, >=5->top3 0, rank1 regr 2, new rank1 2. 2 rank-1 regressions (NOCOS standup 1->12); 'first hear about NOCOS' 26->9; 0 golds >=5 -> top3; fails keep rule", "commit": "", "metrics": {"quality": 0.5423, "hit_rate": 0.5789, "mrr": 0.4568, "recall@10": 0.9211, "latency_p95_ms": 465.6}, "seq": 106}
{"key": "jev_b2_gate0.8", "date": "", "era": "42 gold curated (sep17)", "disposition": "kill", "status": "ok", "delta": -0.0734, "note": "B2 dev, +nojunk, jev-k 50, rel-1. vs anchor 0.5283: delta -0.0734. moves up 0 / down 4, >=5->top3 0, rank1 regr 3, new rank1 0. never moved a gold up; 3 rank-1 regressions", "commit": "", "metrics": {"quality": 0.4549, "hit_rate": 0.5, "mrr": 0.3496, "recall@10": 0.9211, "latency_p95_ms": 277.4}, "seq": 107}
{"key": "jev_b2_gate0.9", "date": "", "era": "42 gold curated (sep17)", "disposition": "kill", "status": "ok", "delta": -0.032, "note": "B2 dev, +nojunk, jev-k 50, rel-1. vs anchor 0.5283: delta -0.0320. moves up 0 / down 1, >=5->top3 0, rank1 regr 1, new rank1 0. never moved a gold up; 1 rank-1 regression (hvem er jeg gift med 1->2)", "commit": "", "metrics": {"quality": 0.4963, "hit_rate": 0.5526, "mrr": 0.3647, "recall@10": 0.9211, "latency_p95_ms": 312.2}, "seq": 108}
{"key": "jev_b4_ceiling", "date": "", "era": "42 gold curated (sep17)", "disposition": "kill", "status": "partial:credits", "delta": null, "note": "Ceiling measurement, not a candidate. PARTIAL: 16/42 golds (all dev), TypeSafe credits exhausted (402). Pure-Jev rel-1 over 53,770 candidates (items+consolidations), optimistic tie ranks; hybrid+nojunk on the same 16: quality 0.4232 hit 0.375 mrr 0.5619 recall@10 0.875. Gold noul median 0.815 (2/16 < 0.5) but many distractors score higher. 1 hybrid-blind gold (Emilie, bad label), Jev ranks it 29,551. 116 Jev-only top-10 finds, 30-sample owner sheet b4_full_jev_only.tsv. $0.34/query, ~57 s.", "commit": "777b8c0", "metrics": {"quality": 0.1152, "hit_rate": 0.125, "mrr": 0.2941, "recall@10": 0.5625, "latency_p95_ms": null}, "seq": 109}
{"key": "jeff_a1_junk_en", "date": "", "era": "42 gold curated (sep17)", "disposition": "kill", "status": "done", "delta": null, "note": "Not a retrieval-fitness run. Jeff-Qwen3.5-0.8B (local MLX, run 0.8b-20260928-0540), zero-shot, A1 scope (24,495 rows), en rubric, F1 format: kappa@0.5 vs Sonnet consensus 0.193 (Jev 0.651; Sonnet self 0.559), en 0.270 / nb 0.123, ECE 0.247, scores squeezed into 0.3-0.7. Owner sheet 19/50 (Jev 26, Sonnet 24). kappa vs Jev 0.192. $0, ~80 ms/decision, 20-30 s per 256-q request.", "commit": "f816172", "metrics": {"quality": null, "hit_rate": null, "mrr": null, "recall@10": null, "latency_p95_ms": null}, "seq": 110}
{"key": "jeff_a1_junk_nb", "date": "", "era": "42 gold curated (sep17)", "disposition": "kill", "status": "done", "delta": null, "note": "Not a retrieval-fitness run. Jeff 0.8B zero-shot, Bokmal rubric: kappa@0.5 vs consensus 0.011 (no signal); calls 88% of consensus rows JUNK, so owner sheet 44/50 is the all-JUNK artefact (owner said JUNK on 49/50), not skill. ECE 0.368. Norwegian rubric breaks the English-only model.", "commit": "f816172", "metrics": {"quality": null, "hit_rate": null, "mrr": null, "recall@10": null, "latency_p95_ms": null}, "seq": 111}
{"key": "jeff_a2_validate", "date": "", "era": "42 gold curated (sep17)", "disposition": "kill", "status": "done", "delta": null, "note": "Not a retrieval-fitness run. Jeff 0.8B zero-shot rel-1 judge over fresh-parse hybrid top-50, 42 golds: gold in pool 35/42; Jeff-order rank1 10 / top3 16 vs hybrid 12 / 22; AUC gold vs unlabeled 0.71 (Jev 0.882 on its 26 cached golds); gold noul median 0.25; owner junk labels AUC 0.462 (37). 0 parse fallbacks.", "commit": "f816172", "metrics": {"quality": null, "hit_rate": null, "mrr": null, "recall@10": null, "latency_p95_ms": null}, "seq": 112}
{"key": "jeff_ft_junk_v1", "date": "", "era": "42 gold curated (sep17)", "disposition": "kill", "status": "pending-owner-sample", "delta": null, "note": "Not a retrieval-fitness run. Jeff-Qwen3.5-0.8B fine-tuned for junk on KWIN RTX 3070 (1 epoch, 87 steps, lr 5e-6, 24 min, peak 4.4 GB VRAM), data jeff_junk_ftdata.py junk-v1 (22,096 train rows, labels = owner bar: JUNK if either Sonnet run or Jev says so; lean prompt, no rubric). Dev (auto labels): acc 0.458 -> 0.857, ECE 0.223 -> 0.022. Owner-labelled A1 disagreement rows: 37/50 (Jev 26, Sonnet 24, zero-shot Jeff 19; all-JUNK baseline 49). Verdict pending the 200-row blind owner sheet.", "commit": "", "metrics": {"quality": null, "hit_rate": null, "mrr": null, "recall@10": null, "latency_p95_ms": null}, "seq": 113}
{"key": "jeff_ft_junk_v1", "date": "", "era": "42 gold curated (sep17)", "disposition": "kill", "status": "owner200", "delta": null, "note": "Owner 200 blind random labels (10-39 char band): owner JUNK 177/200 (88.5%). Fine-tuned Jeff v1 @0.5: acc 0.525, kappa 0.166, junk recall 0.46, keeps all 23 owner KEEPs; best judge, but far from owner bar. Others: Sonnet run1 kappa 0.102, Sonnet consensus (applied in live db) 0.037 / junk recall 0.18, Jev en 0.088 / nb 0.073, zero-shot Jeff 0.044, v1 training labels 0.124. Fine-tuned tau 0.08 -> kappa 0.34 (fitted on eval, optimistic). Training labels are the bottleneck: relabel at owner bar for v2. scripts/junk_owner_score.py.", "commit": "", "metrics": {"quality": null, "hit_rate": null, "mrr": null, "recall@10": null, "latency_p95_ms": null}, "seq": 114}
{"key": "jeff_ft_junk_v2", "date": "", "era": "42 gold curated (sep17)", "disposition": "kill", "status": "owner200", "delta": null, "note": "Not a retrieval-fitness run. Jeff 0.8B fine-tuned on KWIN with owner-bar labels (Copilot claude-sonnet-5 + owner rubric junk_verdict_prompt.owner.md, 83% JUNK). Owner test half (n 101-200, 97 J / 3 K, untouched): v2@0.5 acc 0.90 junk caught 0.90 keeps 3/3; v2@0.73 (tau from tune) acc 0.85 caught 0.85 keeps 3/3; v1@0.5 caught 0.46; Sonnet consensus (live db) caught 0.20; relabel labels themselves caught 0.87 keeps 3/3. Tune half: v2@0.73 keeps 16/20 (loses 4 context-anchored keeps), @0.5 keeps 10/20. Test has only 3 keeps: keep-protection not measurable there. scripts/junk_owner_score_v2.py.", "commit": "", "metrics": {"quality": null, "hit_rate": null, "mrr": null, "recall@10": null, "latency_p95_ms": null}, "seq": 115}
{"key": "gliner2_junk_zeroshot", "date": "", "era": "42 gold curated (sep17)", "disposition": "kill", "status": "owner200", "delta": null, "note": "Not a retrieval-fitness run. GLiNER2 (fastino/gliner2-base-v1, English DeBERTa-v3-base 205M) zero-shot junk classification via Gliner2Swift/MLX on M4 Pro, owner 200 labels: AUC 0.614 (TARGET only) / 0.520 (prev/TARGET/next) vs fine-tuned Jeff v2 0.916; at tune-chosen tau it hides nearly everything (keeps 1-3/23 owner KEEPs), so its 0.86-0.88 accuracy is the base rate. Speed 9-12 ms/decision vs Jeff v2 45 ms (MLX). Zero-shot only: no GLiNER2 fine-tune yet (Swift is inference-only; LoRA would be trained in Python). Harness ~/code/gliner2-bench.", "commit": "", "metrics": {"quality": null, "hit_rate": null, "mrr": null, "recall@10": null, "latency_p95_ms": null}, "seq": 116}
{"key": "mmbert_junk_ane", "date": "", "era": "42 gold curated (sep17)", "disposition": "kill", "status": "owner200", "delta": null, "note": "Not a retrieval-fitness run. mmBERT-base (307M, multilingual ModernBERT) fine-tuned on the v2 junk labels via jeff's encoder path on KWIN (2 epochs, lr 3e-5, 16 min, 1.8 GB VRAM; dev acc 0.880 vs Jeff v2 0.865). Core ML conversion (scripts/ane, own masks; parity 0.0 vs stock forward), 885-891/898 ops on the ANE; ANE vs PyTorch scores mean |diff| 0.0015, 0 flips. Speed/power on M4 Pro (1,344 dev rows, mactop): ANE 100 rows/s, +4.0 W, 40 mJ/row; Core ML GPU 87 rows/s +26 W 300 mJ/row; CPU 57 rows/s 76 mJ/row; Jeff v2 MLX GPU 28.5 rows/s +26.6 W 933 mJ/row. Accuracy (owner 200): AUC all 0.898 vs Jeff v2 0.916, test 0.979 vs 0.979; at equal keep protection (>=16/20 tune keeps) test junk caught 0.79 vs 0.85.", "commit": "", "metrics": {"quality": null, "hit_rate": null, "mrr": null, "recall@10": null, "latency_p95_ms": null}, "seq": 117}
{"key": "ane_probe_bucket64", "date": "", "era": "42 gold curated (sep17)", "disposition": "kill", "status": "probe", "delta": null, "note": "v3.1 0.2 probe. 64-token static bucket for the mmBERT junk encoder: only 51/2688 dev pairs (1.9%) fit in 64 tokens (pairs carry the question segment + option), so it cannot move throughput. Not benchmarked. Baseline re-measured: 128/256 buckets CPU_AND_NE 101.1 rows/s, 39.7 mJ/row, parity vs PyTorch mean 0.0015 max 0.0145 0 flips@0.65.", "commit": "", "metrics": {"quality": null, "hit_rate": null, "mrr": null, "recall@10": null, "latency_p95_ms": null}, "seq": 118}
{"key": "ane_probe_int8", "date": "", "era": "42 gold curated (sep17)", "disposition": "kill", "status": "probe", "delta": null, "note": "v3.1 0.2 probe. int8 weights (coremltools 9 linear_quantize_weights, per-channel; also embedding excluded, linear-only, per-tensor): ANE 102.5 rows/s, 30.0 mJ/row (-25%) but parity BROKEN on the ANE: mean |p-PyTorch| 0.294, max 0.47, 155/200 flips@0.65 (per-tensor 0.206/75). Same int8 model is correct on CPU (mean 0.006) and GPU (mean 0.0044, max 0.05, 2 flips): an ANE int8 execution problem for this graph (coremltools 9.0 / torch 2.14 untested combo / macOS 26), not the quantization. Candidate for a minimal repro + Apple/coremltools report.", "commit": "", "metrics": {"quality": null, "hit_rate": null, "mrr": null, "recall@10": null, "latency_p95_ms": null}, "seq": 119}
{"key": "ane_probe_pal8", "date": "", "era": "42 gold curated (sep17)", "disposition": "kill", "status": "probe", "delta": null, "note": "v3.1 0.2 probe. 8-bit palettization (uniform, embedding fp16): correct on the ANE (mean 0.0088, max 0.0616, 1 flip@0.65 -> fails the 0-flip gate by one row) but no gain: 102.0 rows/s, 48.2 mJ/row (noise vs 39.7). Weight compression saves disk/memory only; the ANE is fp16-compute-bound here.", "commit": "", "metrics": {"quality": null, "hit_rate": null, "mrr": null, "recall@10": null, "latency_p95_ms": null}, "seq": 120}
{"key": "ane_probe_w8a8", "date": "", "era": "42 gold curated (sep17)", "disposition": "kill", "status": "probe", "delta": null, "note": "v3.1 0.2 probe. W8A8 (int8 activations of linear layers, calibrated on 64 dev pairs, + int8 weights): 120.1 rows/s (1.19x), 17.1 mJ/row (-57%), 1241-1247 ops on ANE, but parity broken like int8 (mean 0.40, max 0.86, 143 flips). The prize if ANE int8 numerics get fixed. Global activation config fails on the int32 token inputs; restrict to linear ops.", "commit": "", "metrics": {"quality": null, "hit_rate": null, "mrr": null, "recall@10": null, "latency_p95_ms": null}, "seq": 121}
{"key": "ane_probe_layout", "date": "", "era": "42 gold curated (sep17)", "disposition": "kill", "status": "probe", "delta": null, "note": "v3.1 0.2 probe. One ModernBERT-sized layer (768/12 heads/GeGLU 1152, batch 16 x seq 128, random weights, fp16, CPU_AND_NE), all ops on the ANE both ways: current (Linear on B,S,C ~ channels-last) 3.90 ms/call vs Apple ml-ane-transformers layout (B,C,1,S, conv1x1, per-head einsum, channel LayerNorm) 3.10 ms/call = 1.26x, stable over repeats; below the 1.3x keep bar, so no full rewrite (RoPE, alternating local/global attention, GeGLU). The checklist's NHWC advice is not better than the current graph; Apple's channels-first wins modestly.", "commit": "", "metrics": {"quality": null, "hit_rate": null, "mrr": null, "recall@10": null, "latency_p95_ms": null}, "seq": 122}
{"key": "ane_probe_coldload", "date": "", "era": "42 gold curated (sep17)", "disposition": "kill", "status": "probe", "delta": null, "note": "v3.1 0.2 measurement (not a candidate). Cold load, fresh process, CPU_AND_NE: from .mlpackage every process 7.5 s (L128) / 19.3 s (L256); from a compiled .mlmodelc at a stable path the first load is the same (ANE compile), later loads 0.04-0.05 s (OS caches the ANE program per path); first predict 0.08 / 0.17 s; import coremltools 1.1 s; steady 70 / 168 ms per 16-pair batch. Runtime must ship/cache .mlmodelc at a fixed path and stay warm (import cost) for the query path.", "commit": "", "metrics": {"quality": null, "hit_rate": null, "mrr": null, "recall@10": null, "latency_p95_ms": null}, "seq": 123}
{"key": "parse_ablation_factual", "date": "", "era": "42 gold curated (sep17)", "disposition": "kill", "status": "probe", "delta": 0.0046, "note": "v3.1 Phase 2.1 ablation (measurement, not a candidate): harness dev +nojunk on fixture copy with --parse-mode factual (stored LLM parse; factual). dev quality 0.5329 vs anchor 0.5283; split all 0.5323 vs 0.5285. Shape forced factual is noise (+0.005); dropping dates -0.081, topics -0.068, entities -0.063, whole parse -0.174: a parse model must extract dates/topics/entities, not shape.", "commit": "", "metrics": {"quality": 0.5329, "hit_rate": 0.5789, "mrr": 0.6971, "recall@10": 0.9211, "latency_p95_ms": 197.8}, "seq": 124}
{"key": "parse_ablation_none", "date": "", "era": "42 gold curated (sep17)", "disposition": "kill", "status": "probe", "delta": -0.1744, "note": "v3.1 Phase 2.1 ablation (measurement, not a candidate): harness dev +nojunk on fixture copy with --parse-mode none (stored LLM parse; none). dev quality 0.3539 vs anchor 0.5283; split all 0.3787 vs 0.5285. Shape forced factual is noise (+0.005); dropping dates -0.081, topics -0.068, entities -0.063, whole parse -0.174: a parse model must extract dates/topics/entities, not shape.", "commit": "", "metrics": {"quality": 0.3539, "hit_rate": 0.3684, "mrr": 0.4944, "recall@10": 0.7632, "latency_p95_ms": 131.3}, "seq": 125}
{"key": "parse_ablation_noentities", "date": "", "era": "42 gold curated (sep17)", "disposition": "kill", "status": "probe", "delta": -0.0632, "note": "v3.1 Phase 2.1 ablation (measurement, not a candidate): harness dev +nojunk on fixture copy with --parse-mode noentities (stored LLM parse; noentities). dev quality 0.4651 vs anchor 0.5283; split all 0.4728 vs 0.5285. Shape forced factual is noise (+0.005); dropping dates -0.081, topics -0.068, entities -0.063, whole parse -0.174: a parse model must extract dates/topics/entities, not shape.", "commit": "", "metrics": {"quality": 0.4651, "hit_rate": 0.5263, "mrr": 0.6474, "recall@10": 0.9211, "latency_p95_ms": 250.1}, "seq": 126}
{"key": "parse_ablation_nodates", "date": "", "era": "42 gold curated (sep17)", "disposition": "kill", "status": "probe", "delta": -0.0805, "note": "v3.1 Phase 2.1 ablation (measurement, not a candidate): harness dev +nojunk on fixture copy with --parse-mode nodates (stored LLM parse; nodates). dev quality 0.4478 vs anchor 0.5283; split all 0.456 vs 0.5285. Shape forced factual is noise (+0.005); dropping dates -0.081, topics -0.068, entities -0.063, whole parse -0.174: a parse model must extract dates/topics/entities, not shape.", "commit": "", "metrics": {"quality": 0.4478, "hit_rate": 0.4737, "mrr": 0.5906, "recall@10": 0.8421, "latency_p95_ms": 211.3}, "seq": 127}
{"key": "parse_ablation_notopics", "date": "", "era": "42 gold curated (sep17)", "disposition": "kill", "status": "probe", "delta": -0.0676, "note": "v3.1 Phase 2.1 ablation (measurement, not a candidate): harness dev +nojunk on fixture copy with --parse-mode notopics (stored LLM parse; notopics). dev quality 0.4607 vs anchor 0.5283; split all 0.4668 vs 0.5285. Shape forced factual is noise (+0.005); dropping dates -0.081, topics -0.068, entities -0.063, whole parse -0.174: a parse model must extract dates/topics/entities, not shape.", "commit": "", "metrics": {"quality": 0.4607, "hit_rate": 0.5, "mrr": 0.619, "recall@10": 0.8421, "latency_p95_ms": 240.9}, "seq": 128}
{"key": "parse_reparse_fallback_golds", "date": "", "era": "42 gold curated (sep17)", "disposition": "kill", "status": "probe", "delta": -0.0237, "note": "v3.1 Phase 2.2: 7 gold queries had silent fallback parses (no entities; 73/79 fallbacks are May-June when no parser backend was configured). Re-parsing the 6 fixture golds as of their ask date (scripts/reparse_fallback_golds.py, harness --parse-override) LOWERS dev quality 0.5283 -> 0.5046: the fresh parse routes 'when did I last speak with Fredrik Nordmoen?' as last_occurrence, gold rank 1/7 -> 39/22. Fresh parses also resolve NO entity for 'Fredrik Nordmoen' (fixture entity dictionary gap). Keep stored parses; findings: shape routing only hurts (cf. seq 124), entity resolution has gaps.", "commit": "", "metrics": {"quality": 0.5046, "hit_rate": 0.5526, "mrr": 0.6629, "recall@10": 0.8421, "latency_p95_ms": null}, "seq": 129}
{"key": "jeff_v3_junk_ane_decision", "date": "", "era": "42 gold curated (sep17)", "disposition": "kill", "status": "decided", "delta": null, "note": "v3.1 Phase 1 decision (read test-2 once). Sweep on junk-v3 (relabels + 100 owner rows x5), dev NLL on auto labels: mmBERT-small 0.317/0.319, mmBERT-base 0.301 (3e-5, finalist)/0.319, borealis-embed-212m 0.318/0.321, nb-bert-large 0.320/0.317. Finalist on Core ML ANE (parity vs PyTorch mean 0.0008 max 0.009; 101 rows/s, 35 mJ/row) vs Jeff v2 MLX on test-2 (241 J / 9 K), CV thresholds on the 200 dev labels (keep 80%): junk caught 0.672 vs 0.751, diff -0.079, 90% LB -0.104 (rule needs > -0.05) -> FAIL; keeps lost 0/9 vs 0/9 (sanity ok). Jeff v2 stays the ingest junk model. Per plan the next lever is labels, not bases.", "commit": "", "metrics": {"quality": null, "hit_rate": null, "mrr": null, "recall@10": null, "latency_p95_ms": null}, "seq": 130}
