{"key": "baseline-fts", "date": "2026-06-18", "era": "≈46 gold (phase 2)", "disposition": "baseline", "status": "ok", "delta": null, "note": "mode=fts split=all regressions=0", "commit": "", "metrics": {"quality": 0.3228, "hit_rate": 0.3922, "mrr": 0.1611, "recall@10": null, "latency_p95_ms": 86.5}, "seq": 1}
{"key": "baseline-hybrid", "date": "2026-06-18", "era": "≈46 gold (phase 2)", "disposition": "baseline", "status": "ok", "delta": null, "note": "mode=hybrid split=all regressions=0", "commit": "", "metrics": {"quality": 0.3924, "hit_rate": 0.4706, "mrr": 0.2098, "recall@10": null, "latency_p95_ms": 108.5}, "seq": 2}
{"key": "baseline-hybrid-dev", "date": "2026-06-18", "era": "≈46 gold (phase 2)", "disposition": "baseline", "status": "ok", "delta": null, "note": "mode=hybrid split=dev regressions=0", "commit": "", "metrics": {"quality": 0.4112, "hit_rate": 0.4889, "mrr": 0.2299, "recall@10": null, "latency_p95_ms": 103.7}, "seq": 3}
{"key": "baseline-fts-dev", "date": "2026-06-18", "era": "≈46 gold (phase 2)", "disposition": "baseline", "status": "ok", "delta": null, "note": "mode=fts split=dev regressions=0", "commit": "", "metrics": {"quality": 0.3464, "hit_rate": 0.4, "mrr": 0.2212, "recall@10": null, "latency_p95_ms": 57.6}, "seq": 4}
{"key": "rrf30", "date": "2026-06-18", "era": "≈46 gold (phase 2)", "disposition": "keep", "status": "ok", "delta": null, "note": "mode=hybrid split=dev regressions=0", "commit": "", "metrics": {"quality": 0.4349, "hit_rate": 0.5333, "mrr": 0.2208, "recall@10": null, "latency_p95_ms": 108.5}, "seq": 5}
{"key": "cb1.0", "date": "2026-06-18", "era": "≈46 gold (phase 2)", "disposition": "kill", "status": "discard", "delta": null, "note": "mode=hybrid split=dev regressions=2", "commit": "", "metrics": {"quality": 0.4672, "hit_rate": 0.5333, "mrr": null, "recall@10": null, "latency_p95_ms": 112.0}, "seq": 6}
{"key": "cb1.3", "date": "2026-06-18", "era": "≈46 gold (phase 2)", "disposition": "kill", "status": "discard", "delta": null, "note": "mode=hybrid split=dev regressions=1", "commit": "", "metrics": {"quality": 0.4318, "hit_rate": 0.5333, "mrr": null, "recall@10": null, "latency_p95_ms": 117.7}, "seq": 7}
{"key": "cb2.0", "date": "2026-06-18", "era": "≈46 gold (phase 2)", "disposition": "kill", "status": "discard", "delta": null, "note": "mode=hybrid split=dev regressions=7", "commit": "", "metrics": {"quality": 0.3422, "hit_rate": 0.4, "mrr": null, "recall@10": null, "latency_p95_ms": 105.3}, "seq": 8}
{"key": "pk100", "date": "2026-06-18", "era": "≈46 gold (phase 2)", "disposition": "kill", "status": "discard", "delta": null, "note": "mode=hybrid split=dev regressions=1", "commit": "", "metrics": {"quality": 0.4351, "hit_rate": 0.5333, "mrr": null, "recall@10": null, "latency_p95_ms": 114.4}, "seq": 9}
{"key": "pk120", "date": "2026-06-18", "era": "≈46 gold (phase 2)", "disposition": "kill", "status": "discard", "delta": null, "note": "mode=hybrid split=dev regressions=1", "commit": "", "metrics": {"quality": 0.4352, "hit_rate": 0.5333, "mrr": null, "recall@10": null, "latency_p95_ms": 114.3}, "seq": 10}
{"key": "pk80", "date": "2026-06-18", "era": "≈46 gold (phase 2)", "disposition": "keep", "status": "ok", "delta": null, "note": "mode=hybrid split=dev regressions=0", "commit": "", "metrics": {"quality": 0.4379, "hit_rate": 0.5333, "mrr": 0.2208, "recall@10": null, "latency_p95_ms": 110.4}, "seq": 11}
{"key": "fts-prefix", "date": "2026-06-18", "era": "≈46 gold (phase 2)", "disposition": "kill", "status": "discard", "delta": null, "note": "mode=hybrid split=dev regressions=1", "commit": "", "metrics": {"quality": 0.4393, "hit_rate": 0.5556, "mrr": 0.3318, "recall@10": null, "latency_p95_ms": 164.6}, "seq": 12}
{"key": "prefix5", "date": "2026-06-18", "era": "≈46 gold (phase 2)", "disposition": "keep", "status": "ok", "delta": null, "note": "mode=hybrid split=dev regressions=0", "commit": "", "metrics": {"quality": 0.459, "hit_rate": 0.5778, "mrr": 0.3229, "recall@10": null, "latency_p95_ms": 157.1}, "seq": 13}
{"key": "bm25w-s2", "date": "2026-06-18", "era": "≈46 gold (phase 2)", "disposition": "keep", "status": "ok", "delta": null, "note": "mode=hybrid split=dev regressions=0", "commit": "", "metrics": {"quality": 0.504, "hit_rate": 0.5778, "mrr": 0.3375, "recall@10": null, "latency_p95_ms": 159.7}, "seq": 14}
{"key": "bm25w-s3", "date": "2026-06-18", "era": "≈46 gold (phase 2)", "disposition": "kill", "status": "discard", "delta": null, "note": "mode=hybrid split=dev regressions=1", "commit": "", "metrics": {"quality": 0.4777, "hit_rate": 0.5556, "mrr": 0.3063, "recall@10": null, "latency_p95_ms": 161.9}, "seq": 15}
{"key": "bm25w-s2.5", "date": "2026-06-18", "era": "≈46 gold (phase 2)", "disposition": "kill", "status": "discard", "delta": null, "note": "mode=hybrid split=dev regressions=0", "commit": "", "metrics": {"quality": 0.5046, "hit_rate": 0.5778, "mrr": 0.3375, "recall@10": null, "latency_p95_ms": 157.3}, "seq": 16}
{"key": "bm25w-p2", "date": "2026-06-18", "era": "≈46 gold (phase 2)", "disposition": "kill", "status": "discard", "delta": null, "note": "mode=hybrid split=dev regressions=0", "commit": "", "metrics": {"quality": 0.5023, "hit_rate": 0.5778, "mrr": 0.3375, "recall@10": null, "latency_p95_ms": 165.1}, "seq": 17}
{"key": "subjtok-1.1", "date": "2026-06-18", "era": "≈46 gold (phase 2)", "disposition": "kill", "status": "discard", "delta": null, "note": "mode=hybrid split=dev regressions=2", "commit": "", "metrics": {"quality": 0.5026, "hit_rate": 0.5556, "mrr": 0.3792, "recall@10": null, "latency_p95_ms": 157.8}, "seq": 18}
{"key": "subjtok-1.05", "date": "2026-06-18", "era": "≈46 gold (phase 2)", "disposition": "kill", "status": "discard", "delta": null, "note": "mode=hybrid split=dev regressions=0", "commit": "", "metrics": {"quality": 0.5035, "hit_rate": 0.5778, "mrr": 0.3375, "recall@10": null, "latency_p95_ms": 163.2}, "seq": 19}
{"key": "subjtok-1.08", "date": "2026-06-18", "era": "≈46 gold (phase 2)", "disposition": "kill", "status": "discard", "delta": null, "note": "mode=hybrid split=dev regressions=2", "commit": "", "metrics": {"quality": 0.4722, "hit_rate": 0.5333, "mrr": 0.3479, "recall@10": null, "latency_p95_ms": 168.5}, "seq": 20}
{"key": "subjtok-all-1.1", "date": "2026-06-18", "era": "≈46 gold (phase 2)", "disposition": "kill", "status": "discard", "delta": null, "note": "mode=hybrid split=dev regressions=1", "commit": "", "metrics": {"quality": 0.5148, "hit_rate": 0.5778, "mrr": 0.3792, "recall@10": null, "latency_p95_ms": 165.1}, "seq": 21}
{"key": "subjtok-all-1.07", "date": "2026-06-18", "era": "≈46 gold (phase 2)", "disposition": "kill", "status": "discard", "delta": null, "note": "mode=hybrid split=dev regressions=1", "commit": "", "metrics": {"quality": 0.4867, "hit_rate": 0.5556, "mrr": 0.3479, "recall@10": null, "latency_p95_ms": 170.1}, "seq": 22}
{"key": "subjtok-cons-1.1", "date": "2026-06-18", "era": "≈46 gold (phase 2)", "disposition": "kill", "status": "discard", "delta": null, "note": "mode=hybrid split=dev regressions=0", "commit": "", "metrics": {"quality": 0.5051, "hit_rate": 0.5778, "mrr": 0.3375, "recall@10": null, "latency_p95_ms": 160.6}, "seq": 23}
{"key": "recency-f0.9", "date": "2026-06-18", "era": "≈46 gold (phase 2)", "disposition": "kill", "status": "discard", "delta": null, "note": "mode=hybrid split=dev regressions=4", "commit": "", "metrics": {"quality": 0.4314, "hit_rate": 0.4889, "mrr": 0.3115, "recall@10": null, "latency_p95_ms": 166.5}, "seq": 24}
{"key": "veck-1.5", "date": "2026-06-18", "era": "≈46 gold (phase 2)", "disposition": "kill", "status": "discard", "delta": null, "note": "mode=hybrid split=dev regressions=1", "commit": "", "metrics": {"quality": 0.5024, "hit_rate": 0.5778, "mrr": 0.3375, "recall@10": null, "latency_p95_ms": 165.0}, "seq": 25}
{"key": "veck-1.25", "date": "2026-06-18", "era": "≈46 gold (phase 2)", "disposition": "kill", "status": "discard", "delta": null, "note": "mode=hybrid split=dev regressions=1", "commit": "", "metrics": {"quality": 0.5032, "hit_rate": 0.5778, "mrr": 0.3375, "recall@10": null, "latency_p95_ms": 163.7}, "seq": 26}
{"key": "veck-0.75", "date": "2026-06-18", "era": "≈46 gold (phase 2)", "disposition": "kill", "status": "discard", "delta": null, "note": "mode=hybrid split=dev regressions=0", "commit": "", "metrics": {"quality": 0.5016, "hit_rate": 0.5778, "mrr": 0.3375, "recall@10": null, "latency_p95_ms": 166.3}, "seq": 27}
{"key": "boost3.0", "date": "2026-06-19", "era": "58 gold (jun19)", "disposition": "keep", "status": "keep", "delta": null, "note": "entity boost 1.5->3.0; q held, mrr up", "commit": "", "metrics": {"quality": 0.5109, "hit_rate": 0.587, "mrr": 0.3531, "recall@10": null, "latency_p95_ms": 168.5}, "seq": 28}
{"key": "temporal_range_deboost", "date": "2026-06-19", "era": "58 gold (jun19)", "disposition": "keep", "status": "keep", "delta": null, "note": "narrow-window consolidation de-boost; q 0.5121->0.5243", "commit": "", "metrics": {"quality": 0.5243, "hit_rate": 0.6034, "mrr": 0.3629, "recall@10": null, "latency_p95_ms": 153.6}, "seq": 29}
{"key": "event_anchored_deboost", "date": "2026-06-20", "era": "78 gold (jun20)", "disposition": "keep", "status": "win", "delta": 0.0096, "note": "Apply the narrow-window (≤3d) consolidation de-boost of 0.85 to event_anchored items as well, gated on the same window-width condition used for the temporal_range gate — the \"27 april UNE Vibeke\" gold is buried by the 1.3 cons boost and reranking cannot recover a buried result; risk of regressing other event golds that rely on the boost is mitigated by the window-width gate (only fire when date span ≤3 days).", "commit": "", "metrics": {"quality": 0.5502, "hit_rate": 0.6207, "mrr": 0.3856, "recall@10": null, "latency_p95_ms": 153.3}, "seq": 30}
{"key": "rrf_k_resweep_dense", "date": "2026-06-20", "era": "78 gold (jun20)", "disposition": "kill", "status": "no_change", "delta": -0.0093, "note": "RRF_K re-sweep on the denser gold set: the parameter was last tuned (60→30) on the sparse label set; the jun19 densification to 68 golds may have moved the optimum. Sweep RRF_K over [20, 25, 30, 40, 50] in yaams/retrieve/hybrid.py and keep the value that maximises dev quality without regression.", "commit": "", "metrics": {"quality": 0.5313, "hit_rate": 0.6034, "mrr": 0.3629, "recall@10": null, "latency_p95_ms": 141.5}, "seq": 31}
{"key": "consolidation_boost_resweep", "date": "2026-06-20", "era": "78 gold (jun20)", "disposition": "keep", "status": "keep", "delta": 0.0093, "note": "Re-sweep consolidation_boost default (currently 1.1) now that temporal de-boost is gated separately — the temporal regression that previously blocked movement of this value no longer applies, so the global knob may move freely and could yield a quality gain.", "commit": "", "metrics": {"quality": 0.5406, "hit_rate": 0.6034, "mrr": 0.3939, "recall@10": null, "latency_p95_ms": 154.0}, "seq": 32}
{"key": "per_field_bm25_sender_weight", "date": "2026-06-20", "era": "78 gold (jun20)", "disposition": "kill", "status": "discarded", "delta": -0.0128, "note": "per-field bm25: sender weight currently 1.0 — lowering it did not reduce false matches on chatty senders and lost quality; FTS_ITEM_WEIGHTS in hybrid.py", "commit": "", "metrics": {"quality": 0.5278, "hit_rate": 0.6034, "mrr": 0.3512, "recall@10": null, "latency_p95_ms": 143.1}, "seq": 33}
{"key": "per_index_k_resweep", "date": "2026-06-20", "era": "78 gold (jun20)", "disposition": "keep", "status": "win", "delta": 0.0057, "note": "DEFAULT_PER_INDEX_K re-sweep on the denser 68-gold set (previously found 60->80 was a win; re-validate the optimal value now that the gold set has grown)", "commit": "", "metrics": {"quality": 0.5463, "hit_rate": 0.6034, "mrr": 0.4129, "recall@10": null, "latency_p95_ms": 143.3}, "seq": 34}
{"key": "consolidation_boost_once", "date": "2026-06-20", "era": "78 gold (jun20)", "disposition": "kill", "status": "discarded", "delta": 0.0, "note": "Apply consolidation_boost to the fused cons score once after the RRF accumulation loop in _fuse(), instead of multiplying it into every contribution inside the loop. Dual-covered cons currently get the boost applied to each index contribution, effectively squaring their advantage over single-index gold items.", "commit": "", "metrics": {"quality": 0.5463, "hit_rate": 0.6034, "mrr": 0.4129, "recall@10": null, "latency_p95_ms": 160.8}, "seq": 35}
{"key": "co_coverage_credit", "date": "2026-06-20", "era": "78 gold (jun20)", "disposition": "kill", "status": "discarded", "delta": 0.0, "note": "single-index penalty / co-coverage credit: in _fuse() after the loop, scale each fused entry's rrf_score by a factor f<1 when only one of (fts_rank, vec_rank) is set (e.g. 0.9), or symmetrically add a small bonus when both are present. Sweep f∈[0.85,0.9,0.95]; guard recall@10 so single-index golds do not drop out of top-10.", "commit": "", "metrics": {"quality": 0.5463, "hit_rate": 0.6034, "mrr": 0.4129, "recall@10": null, "latency_p95_ms": 142.4}, "seq": 36}
{"key": "factual_tier2_boost", "date": "2026-06-20", "era": "78 gold (jun20)", "disposition": "kill", "status": "discarded", "delta": -0.0007, "note": "Raise tier2_boost for the factual shape in route.py (e.g. set cfg.tier2_boost = max(cfg.tier2_boost, 1.6) when parsed.shape==\"factual\"), mirroring the synthesis/prefer_tier paths — targets repeated mrr_partial losses where the canonical ledger fact sits at rank2-3 under chatty conversation items", "commit": "", "metrics": {"quality": 0.5456, "hit_rate": 0.6034, "mrr": 0.4106, "recall@10": null, "latency_p95_ms": 148.1}, "seq": 37}
{"key": "bm25_magnitude_blend", "date": "2026-06-20", "era": "78 gold (jun20)", "disposition": "keep", "status": "keep", "delta": 0.0054, "note": "Blend normalized bm25 magnitude into FTS RRF contribution in _fuse(): for each FTS entry add alpha*normed_magnitude*contribution on top of rank-RRF so exact-lexical-match confidence gaps are visible to the ranker instead of being discarded by pure rank-based RRF", "commit": "", "metrics": {"quality": 0.5517, "hit_rate": 0.6034, "mrr": 0.4311, "recall@10": null, "latency_p95_ms": 153.9}, "seq": 38}
{"key": "sender_participant_rrf_credit", "date": "2026-06-20", "era": "78 gold (jun20)", "disposition": "kill", "status": "discarded", "delta": -0.0043, "note": "For person-shaped factual queries, give items/cons whose sender or participants match query name tokens a small additive RRF bonus in _hydrate. Data is already on the row (sender, participants columns); scope the bonus to person-lookup queries to avoid perturbing topic queries. Diagnosed failure: gold cons land rank 6+ because name appears in content of unrelated docs and the person-as-participant signal is invisible to the current relevance fusion.", "commit": "", "metrics": {"quality": 0.5474, "hit_rate": 0.6034, "mrr": 0.4167, "recall@10": null, "latency_p95_ms": 145.4}, "seq": 39}
{"key": "lexical_top_hit_step_credit", "date": "2026-06-20", "era": "78 gold (jun20)", "disposition": "kill", "status": "discarded", "delta": -0.0266, "note": "In _fuse(), add an additive RRF step bonus for the single best FTS hit only (rank==0): contribution += BETA * base_contribution when fts_rank==0, sweep BETA in [0.10, 0.20, 0.30]. This gives the exact lexical leader a fixed edge over vector-only near-ties without re-introducing the continuous bm25_magnitude_blend scaling. Target: yaams/retrieve/hybrid.py _fuse().", "commit": "", "metrics": {"quality": 0.5251, "hit_rate": 0.5862, "mrr": 0.3826, "recall@10": null, "latency_p95_ms": 148.0}, "seq": 40}
{"key": "single_index_high_rank_credit", "date": "2026-06-20", "era": "78 gold (jun20)", "disposition": "kill", "status": "discarded", "delta": -0.0054, "note": "In _fuse(), when a doc is covered by exactly ONE index but ranks very high there (fts_rank<=2 OR vector_rank<=2), add a small additive RRF credit ~+1/(rrf_k+rank+1)*GAMMA, sweep GAMMA in [0.15, 0.3, 0.5]. Addresses FTS-only tier2 golds (deployment, hvem er jeg gift med, sleep timeline, Jan Guttormsen) that are structurally beaten by mediocre dual-coverage results because RRF caps at one index's contribution.", "commit": "", "metrics": {"quality": 0.5463, "hit_rate": 0.6034, "mrr": 0.4129, "recall@10": null, "latency_p95_ms": 156.4}, "seq": 41}
{"key": "occurrence_relevance_floor_sweep", "date": "2026-06-20", "era": "78 gold (jun20)", "disposition": "kill", "status": "discarded", "delta": -0.0054, "note": "sweep OCCURRENCE_RELEVANCE_FLOOR / generalize relevance_floor to factual shape: relevance_floor is only set for first/last_occurrence (0.2); tried small floor (0.05-0.1) on factual to prune weak-tangential tail that pads top-k, and swept occurrence floor [0.15,0.25,0.3] — quality dropped; factual top-k padding did not yield measurable quality gain", "commit": "", "metrics": {"quality": 0.5463, "hit_rate": 0.6034, "mrr": 0.4129, "recall@10": null, "latency_p95_ms": 154.4}, "seq": 42}
{"key": "fts_only_tier2_recovery", "date": "2026-06-20", "era": "78 gold (jun20)", "disposition": "kill", "status": "discarded", "delta": 0.0, "note": "In _hydrate, for items where source==tier2_source AND comp.vector_rank is None AND comp.fts_rank is not None AND fts_rank<=1, add an ADDITIVE rrf credit equal to one extra index contribution 1/(cfg.rrf_k+fts_rank+1) before applying tier2_boost. Addresses the structural gap where FTS-only tier2 ledger facts (deployment, hvem er jeg gift med, sleep timeline, Jan Guttormsen) can never earn a second RRF contribution because they are absent from the vector index, so they always lose to mediocre dual-coverage items. The tight gate (tier2 + vec_rank None + fts_rank<=1) means non-relevant items are untouched, minimising regression risk.", "commit": "", "metrics": {"quality": 0.5463, "hit_rate": 0.6034, "mrr": 0.4129, "recall@10": null, "latency_p95_ms": 149.4}, "seq": 43}
{"key": "rrf_k_split_fts_vec", "date": "2026-06-20", "era": "78 gold (jun20)", "disposition": "kill", "status": "discarded", "delta": -0.0028, "note": "Give FTS and vector their own rrf_k in _fuse (use cfg.rrf_k for FTS contributions, a separate vec_rrf_k for vector contributions), sweeping vec_rrf_k in [20,40,60] while holding FTS at 30. Add vec_rrf_k field to HybridQueryConfig (default = rrf_k) and branch in _fuse on the is_fts flag already computed.", "commit": "", "metrics": {"quality": 0.5435, "hit_rate": 0.6034, "mrr": 0.4035, "recall@10": null, "latency_p95_ms": 147.0}, "seq": 44}
{"key": "vector_distance_gap_demote", "date": "2026-06-20", "era": "78 gold (jun20)", "disposition": "kill", "status": "discard", "delta": 0.0, "note": "In _fuse()/_hydrate, demote vector-only candidates (fts_rank is None) whose vector_distance is far from the best vector hit — multiply rrf_score by clamp(1 - LAMBDA*(dist - best_dist)/best_dist, FLOOR, 1.0), compute best_dist as min vector_distance across fused, sweep LAMBDA in [0.3,0.5] FLOOR=0.7", "commit": "", "metrics": {"quality": 0.5463, "hit_rate": 0.6034, "mrr": 0.4129, "recall@10": null, "latency_p95_ms": 138.1}, "seq": 45}
{"key": "rank_agreement_multiplier", "date": "2026-06-20", "era": "78 gold (jun20)", "disposition": "keep", "status": "win", "delta": 0.0045, "note": "In _fuse(), after the accumulation loop, multiply rrf_score by (1 + DELTA) only when BOTH comp.fts_rank<=2 AND comp.vector_rank<=2 (mutual top-of-both agreement). Sweep DELTA in [0.05, 0.10, 0.15]. Implement as a post-loop pass over fused.values(). Start at DELTA=0.15. Verify regressions==0.", "commit": "", "metrics": {"quality": 0.5508, "hit_rate": 0.6034, "mrr": 0.428, "recall@10": null, "latency_p95_ms": 139.0}, "seq": 46}
{"key": "atomic_over_cons_near_tie_tiebreak", "date": "2026-06-20", "era": "78 gold (jun20)", "disposition": "kill", "status": "discarded", "delta": 0.0, "note": "In _hydrate, add a stable adjacent-swap pass: when an atomic item B sits directly below a consolidation A and abs(A.rrf_score-B.rrf_score) <= EPS*A.rrf_score, promote the atomic item above the cons; sweep EPS in [0.02,0.04]. Gate out when cfg.prefer_consolidations is True (synthesis shape). Ordering-only — no score changes, zero risk of inflating non-gold candidates. Targets the dominant correction pattern where tier2_ledger facts and atomic notes land rank2-3 a hair behind broad consolidations that merely co-mention the terms (hvem er jeg gift med, deployment, sleep timeline golds).", "commit": "", "metrics": {"quality": 0.5508, "hit_rate": 0.6034, "mrr": 0.428, "recall@10": null, "latency_p95_ms": 147.0}, "seq": 47}
{"key": "min_rank_near_tie_tiebreak", "date": "2026-06-20", "era": "78 gold (jun20)", "disposition": "kill", "status": "discarded", "delta": 0.0, "note": "In _hydrate, after sorting by rrf_score, do a stable bubble pass that swaps adjacent candidates A,B (A above B) when abs(A.rrf_score-B.rrf_score) <= EPS*A.rrf_score AND min(B.fts_rank,B.vector_rank) is strictly better (smaller, None=+inf) than min(A.fts_rank,A.vector_rank); sweep EPS in [0.01,0.02,0.03]", "commit": "", "metrics": {"quality": 0.5508, "hit_rate": 0.6034, "mrr": 0.428, "recall@10": null, "latency_p95_ms": 149.4}, "seq": 48}
{"key": "factual_tier2_boost_lexgated", "date": "2026-06-20", "era": "78 gold (jun20)", "disposition": "kill", "status": "discarded", "delta": 0.0, "note": "In _hydrate, raise tier2_boost for factual-shape queries ONLY when the candidate item lexically matched the query (comp.fts_rank is not None and comp.fts_rank <= 3 for tier2_ledger items), applying cfg.tier2_boost -> max(cfg.tier2_boost, 1.5) under that gate. Narrow per-result multiplier — not a blanket cfg knob — lifts only tier2 docs the query actually hit lexically at a strong FTS rank. Quality unchanged (0.5508, delta=0, regressions=0). DO NOT REVISIT.", "commit": "", "metrics": {"quality": 0.5508, "hit_rate": 0.6034, "mrr": 0.428, "recall@10": null, "latency_p95_ms": 145.0}, "seq": 49}
