round	key	quality	delta	hit_rate	mrr	p95	regressions	status	verdict	note
1	event_anchored_deboost	0.5502	-0.0027	0.6207	0.3856	209	0	discarded	discard	event_anchored gold buried by 1.3 cons boost ('27 april UNE Vibeke') — apply the narrow-window de-boost (≤3d window, factor 0.85) to event_anchored items too, gated on window width just like temporal_range to avoid regressing broader event golds.
1	rrf_k_resweep_dense	0.5313	-0.0093	0.6034	0.3629	141.5	0	no_change	discard	RRF_K re-sweep on the denser gold set: the parameter was last tuned (60→30) on the sparse label set; the jun19 densification to 68 golds may have moved the optimum. Sweep RRF_K over [20, 25, 30, 40, 50] in yaams/retrieve/hybrid.py and keep the value that maximises dev quality without regression.
2	rrf_k_resweep_dense	0.5313	-0.0093	0.6034	0.3629	159.2	0	discarded	discard	RRF_K re-sweep on the denser gold set (was tuned 60→30 on the sparse set) — the jun19 densification to 68 golds may have shifted the optimum; sweep e.g. [20, 25, 30, 35, 40] in hybrid.py and keep the value that strictly improves dev quality.
3	rrf_k_resweep_dense	0.5313	-0.0093	0.6034	0.3629	152.3	1	discarded	discard	RRF_K re-sweep on the denser gold set (was tuned 60→30 on the sparse set) — the jun19 densification to 68 golds may have shifted the optimum; sweep RRF_K across a range (e.g. 20, 30, 40, 50, 60) and keep the value that maximises dev quality.
4	event_anchored_deboost	0.5502	0.0096	0.6207	0.3856	153.3	0	win	discard	Apply the narrow-window (≤3d) consolidation de-boost of 0.85 to event_anchored items as well, gated on the same window-width condition used for the temporal_range gate — the "27 april UNE Vibeke" gold is buried by the 1.3 cons boost and reranking cannot recover a buried result; risk of regressing other event golds that rely on the boost is mitigated by the window-width gate (only fire when date span ≤3 days).
1	consolidation_boost_resweep	0.5406	0.0093	0.6034	0.3939	154	0	keep	WIN	Re-sweep consolidation_boost default (currently 1.1) now that temporal de-boost is gated separately — the temporal regression that previously blocked movement of this value no longer applies, so the global knob may move freely and could yield a quality gain.
2	per_field_bm25_sender_weight	0.5278	-0.0128	0.6034	0.3512	143.1	0	discarded	discard	per-field bm25: sender weight currently 1.0 — lowering it did not reduce false matches on chatty senders and lost quality; FTS_ITEM_WEIGHTS in hybrid.py
3	per_index_k_resweep	0.5463	0.0057	0.6034	0.4129	143.3	0	win	WIN	DEFAULT_PER_INDEX_K re-sweep on the denser 68-gold set (previously found 60->80 was a win; re-validate the optimal value now that the gold set has grown)
1	consolidation_boost_once	0.5463	0	0.6034	0.4129	160.8	0	discarded	discard	Apply consolidation_boost to the fused cons score once after the RRF accumulation loop in _fuse(), instead of multiplying it into every contribution inside the loop. Dual-covered cons currently get the boost applied to each index contribution, effectively squaring their advantage over single-index gold items.
2	co_coverage_credit	0.5463	0	0.6034	0.4129	142.4	0	discarded	discard	single-index penalty / co-coverage credit: in _fuse() after the loop, scale each fused entry's rrf_score by a factor f<1 when only one of (fts_rank, vec_rank) is set (e.g. 0.9), or symmetrically add a small bonus when both are present. Sweep f∈[0.85,0.9,0.95]; guard recall@10 so single-index golds do not drop out of top-10.
3	factual_tier2_boost	0.5456	-0.0007	0.6034	0.4106	148.1	0	discarded	discard	Raise tier2_boost for the factual shape in route.py (e.g. set cfg.tier2_boost = max(cfg.tier2_boost, 1.6) when parsed.shape=="factual"), mirroring the synthesis/prefer_tier paths — targets repeated mrr_partial losses where the canonical ledger fact sits at rank2-3 under chatty conversation items
4	bm25_magnitude_blend	0.5517	0.0054	0.6034	0.4311	153.9	0	keep	WIN	Blend normalized bm25 magnitude into FTS RRF contribution in _fuse(): for each FTS entry add alpha*normed_magnitude*contribution on top of rank-RRF so exact-lexical-match confidence gaps are visible to the ranker instead of being discarded by pure rank-based RRF
5	sender_participant_rrf_credit	0.5474	-0.0043	0.6034	0.4167	145.4	0	discarded	discard	For person-shaped factual queries, give items/cons whose sender or participants match query name tokens a small additive RRF bonus in _hydrate. Data is already on the row (sender, participants columns); scope the bonus to person-lookup queries to avoid perturbing topic queries. Diagnosed failure: gold cons land rank 6+ because name appears in content of unrelated docs and the person-as-participant signal is invisible to the current relevance fusion.
6	lexical_top_hit_step_credit	0.5251	-0.0266	0.5862	0.3826	148	1	discarded	discard	In _fuse(), add an additive RRF step bonus for the single best FTS hit only (rank==0): contribution += BETA * base_contribution when fts_rank==0, sweep BETA in [0.10, 0.20, 0.30]. This gives the exact lexical leader a fixed edge over vector-only near-ties without re-introducing the continuous bm25_magnitude_blend scaling. Target: yaams/retrieve/hybrid.py _fuse().
7	single_index_high_rank_credit	0.5463	-0.0054	0.6034	0.4129	156.4	0	discarded	discard	In _fuse(), when a doc is covered by exactly ONE index but ranks very high there (fts_rank<=2 OR vector_rank<=2), add a small additive RRF credit ~+1/(rrf_k+rank+1)*GAMMA, sweep GAMMA in [0.15, 0.3, 0.5]. Addresses FTS-only tier2 golds (deployment, hvem er jeg gift med, sleep timeline, Jan Guttormsen) that are structurally beaten by mediocre dual-coverage results because RRF caps at one index's contribution.
8	occurrence_relevance_floor_sweep	0.5463	-0.0054	0.6034	0.4129	154.4	0	discarded	discard	sweep OCCURRENCE_RELEVANCE_FLOOR / generalize relevance_floor to factual shape: relevance_floor is only set for first/last_occurrence (0.2); tried small floor (0.05-0.1) on factual to prune weak-tangential tail that pads top-k, and swept occurrence floor [0.15,0.25,0.3] — quality dropped; factual top-k padding did not yield measurable quality gain
1	fts_only_tier2_recovery	0.5463	0	0.6034	0.4129	149.4	0	discarded	discard	In _hydrate, for items where source==tier2_source AND comp.vector_rank is None AND comp.fts_rank is not None AND fts_rank<=1, add an ADDITIVE rrf credit equal to one extra index contribution 1/(cfg.rrf_k+fts_rank+1) before applying tier2_boost. Addresses the structural gap where FTS-only tier2 ledger facts (deployment, hvem er jeg gift med, sleep timeline, Jan Guttormsen) can never earn a second RRF contribution because they are absent from the vector index, so they always lose to mediocre dual-coverage items. The tight gate (tier2 + vec_rank None + fts_rank<=1) means non-relevant items are untouched, minimising regression risk.
2	rrf_k_split_fts_vec	0.5435	-0.0028	0.6034	0.4035	147	0	discarded	discard	Give FTS and vector their own rrf_k in _fuse (use cfg.rrf_k for FTS contributions, a separate vec_rrf_k for vector contributions), sweeping vec_rrf_k in [20,40,60] while holding FTS at 30. Add vec_rrf_k field to HybridQueryConfig (default = rrf_k) and branch in _fuse on the is_fts flag already computed.
3	vector_distance_gap_demote	0.5463	0	0.6034	0.4129	138.1	0	discard	discard	In _fuse()/_hydrate, demote vector-only candidates (fts_rank is None) whose vector_distance is far from the best vector hit — multiply rrf_score by clamp(1 - LAMBDA*(dist - best_dist)/best_dist, FLOOR, 1.0), compute best_dist as min vector_distance across fused, sweep LAMBDA in [0.3,0.5] FLOOR=0.7
4	rank_agreement_multiplier	0.5508	0.0045	0.6034	0.428	139	0	win	WIN	In _fuse(), after the accumulation loop, multiply rrf_score by (1 + DELTA) only when BOTH comp.fts_rank<=2 AND comp.vector_rank<=2 (mutual top-of-both agreement). Sweep DELTA in [0.05, 0.10, 0.15]. Implement as a post-loop pass over fused.values(). Start at DELTA=0.15. Verify regressions==0.
5	atomic_over_cons_near_tie_tiebreak	0.5508	0	0.6034	0.428	147	0	discarded	discard	In _hydrate, add a stable adjacent-swap pass: when an atomic item B sits directly below a consolidation A and abs(A.rrf_score-B.rrf_score) <= EPS*A.rrf_score, promote the atomic item above the cons; sweep EPS in [0.02,0.04]. Gate out when cfg.prefer_consolidations is True (synthesis shape). Ordering-only — no score changes, zero risk of inflating non-gold candidates. Targets the dominant correction pattern where tier2_ledger facts and atomic notes land rank2-3 a hair behind broad consolidations that merely co-mention the terms (hvem er jeg gift med, deployment, sleep timeline golds).
6	min_rank_near_tie_tiebreak	0.5508	0	0.6034	0.428	149.4	0	discarded	discard	In _hydrate, after sorting by rrf_score, do a stable bubble pass that swaps adjacent candidates A,B (A above B) when abs(A.rrf_score-B.rrf_score) <= EPS*A.rrf_score AND min(B.fts_rank,B.vector_rank) is strictly better (smaller, None=+inf) than min(A.fts_rank,A.vector_rank); sweep EPS in [0.01,0.02,0.03]
7	factual_tier2_boost_lexgated	0.5508	0	0.6034	0.428	145	0	discarded	discard	In _hydrate, raise tier2_boost for factual-shape queries ONLY when the candidate item lexically matched the query (comp.fts_rank is not None and comp.fts_rank <= 3 for tier2_ledger items), applying cfg.tier2_boost -> max(cfg.tier2_boost, 1.5) under that gate. Narrow per-result multiplier — not a blanket cfg knob — lifts only tier2 docs the query actually hit lexically at a strong FTS rank. Quality unchanged (0.5508, delta=0, regressions=0). DO NOT REVISIT.
8	subject_exact_match_credit	0.5508	0	0.6034	0.428	138.3	0	discarded	discard	In _hydrate_item, when ALL query topic tokens appear (casefolded substring) in row['subject'], add additive RRF credit BETA*comp.rrf_score, sweep BETA in [0.05, 0.10]. Gate is strict (all tokens must be present), fires only on subjects that fully contain the query intent (e.g. a ledger fact whose subject IS the answer), and stays silent on partial chatty matches. Targets factual golds whose subject exactly names the topic but sit at rank 2-3 under longer-body conversation items. Verify regressions==0.
1	consolidation_boost_shape_gated	0.5508	0	0.6034	0.428	159.1	0	discarded	discard	In _fuse(), apply the cfg.consolidation_boost multiplier to a cons contribution ONLY when the query intent actually wants consolidations — i.e. when the parsed shape is synthesis. ROOT CAUSE found: prefer_consolidations defaults to True in HybridQueryConfig and route.py only ever re-affirms it for synthesis — so the 1.05 consolidation_boost fires on EVERY factual query. Multiple factual golds confirmed losing to boosted cons (troika medlemssak, medlemssak, hvem er jeg gift med, both deployment golds). Keep the boost for synthesis shape.
2	agreement_band_widen_resweep	0.5508	0	0.6034	0.428	162.2	0	discard	discard	Resweep DELTA∈[0.05,0.07,0.10] × THRESH∈[2,3] for rank_agreement_multiplier; best combo matched the shipped defaults (DELTA=0.05, THRESH=2); no improvement over the baseline 0.5508. DO NOT REVISIT.
1	graded_rank_agreement	0.5329	0	0.5909	0.3975	147.5	0	discarded	discard	In _fuse() post-loop pass, replace the single binary <=2 both multiplier with a GRADED schedule (TIER1 when both<=1, current 0.05 when both<=2, TIER3 in [0.02,0.03] when both<=4). Swept TIER1 in [0.08,0.10]. Quality did not improve; graded curve did not catch additional golds vs flat step. DO NOT REVISIT.
2	tier2_factual_coverage_recovery	0.5816	0.0487	0.6364	0.4539	167.7	0	win	keep	IN _hydrate_item: additive RRF credit GAMMA/(rrf_k+fts_rank+1) for tier2 factual FTS-present/vector-absent items; GAMMA=0.5, fts_rank<=5 gate; query_shape forwarded via route.py. WIN q 0.5329->0.5816.
3	dual_coverage_disagreement_demote	0.5816	0	0.6364	0.4539	220.3	0	discarded	discard	In _hydrate, after the rrf_score sort, a single stable adjacent-swap pass that demotes candidate A below the next candidate B when A is SINGLE-index (exactly one of A.fts_rank / A.vector_rank is None) AND B is DUAL-coverage (both ranks present) AND abs(A.rrf-B.rrf) <= EPS*A.rrf, sweep EPS in [0.03,0.06]. Guard: skip the demote when A.source==cfg.tier2_source to protect FTS-only tier2 factual golds. Ordering-only, zero recall risk.
4	consolidation_boost_coverage_gated	0.571	-0.0106	0.6212	0.4539	167.9	1	discarded	discard	In _fuse(), apply cfg.consolidation_boost to a consolidation contribution only for the index where it actually ranks well (fts_rank<=5 or vector_rank<=5 respectively); skip the boost on the weak-ranking index contribution. Gate generously (rank<=5). 1 regression; discard.
5	thread_coherence_credit	0.6144	0.0328	0.6667	0.4924	170.2	0	win	WIN	In _hydrate, additive RRF credit OMEGA*top3_cons_rrf_score for atomic items sharing thread_id with a top-3 consolidation, gated to fts_rank is not None. OMEGA=0.15. WIN q 0.5816->0.6144, regressions=0, recall@10=0.9242.
6	tier2_boost_fused_order_cap	0.625	0.0106	0.6818	0.4924	172.0	0	win	WIN	In _hydrate, after rrf_score sort (else branch), single stable adjacent-swap pass demoting tier2 item A below next non-tier2 B when B pre-boost base rrf strictly > A pre-boost. Ordering-only. WIN q 0.6144->0.6250, regressions=0, recall@10=0.9242.
7	sole_fts_exact_over_vec_only_tiebreak	0.625	0	0.6818	0.4924	170.4	0	park	discard	In _hydrate, ordering-only stable adjacent-swap promoting B (sole FTS fts_rank<=1 vector_rank=None) above A (vector-only) when rrf gap <= EPS*A.rrf; EPS swept [0.02,0.04,0.06]. Targets lexical-exact atomic vs semantic-only cons at near-parity. delta=0, 0 regressions; EPS band too tight to reach any gold. PARK.
8	cons_breadth_mass_normalize	0.625	0	0.6818	0.4924	169.5	0	discarded	discard	In _fuse(), multiply cons contribution by 1.0 / (1.0 + LAMBDA*log1p(item_count)) to normalize sprawling multi-topic cons sessions, swept LAMBDA in [0.05,0.10,0.15]. Quality unchanged (0.625, delta=0, regressions=0). Sprawling cons breadth did not help gold ranking; normalize had no measurable effect.
9	vector_distance_margin_tiebreak	0.625	0	0.6818	0.4924	168.3	0	discarded	discard	In _hydrate, ordering-only stable adjacent-swap promoting B above A when BOTH have vector_distance set AND B.vector_distance <= A.vector_distance - MARGIN (B is materially closer in embedding space) AND rrf gap abs(A.rrf-B.rrf) <= EPS*A.rrf; swept MARGIN over cosine-distance units [0.03,0.05,0.08] and EPS in [0.05,0.08]. Quality unchanged (0.625, delta=0, regressions=0). Distinct from discarded vector_distance_gap_demote (round 3) which applied a multiplicative score penalty — this is a pairwise ordering swap. No gold sat inside the band at any tested MARGIN/EPS combination.
1	bm25_margin_tiebreak	0.6144	0	0.6667	0.4924	182.7	0	park	discard	In _hydrate, ordering-only stable adjacent-swap promoting B above A when BOTH have fts_score set AND B.fts_score <= A.fts_score - MARGIN AND rrf gap abs(A.rrf-B.rrf) <= EPS*A.rrf; swept MARGIN over bm25 units [0.5,1.0] and EPS in [0.05,0.08]. delta=0; no gold sat inside the band at any tested combination.
1	synthesis_cons_near_tie_tiebreak	0.6144	0	0.6667	0.4924	146.7	0	parked	discard	In _hydrate, ONLY when cfg.prefer_consolidations (synthesis shape), stable adjacent-swap promoting consolidation B above atomic A when abs(A.rrf-B.rrf) <= EPS*A.rrf; swept EPS in [0.02,0.04]. delta=0; synthesis golds too few to move the dev scalar.
1	fts_rank_dominance_tiebreak	0.6144	0	0.6667	0.4924	191.2	0	discard	discard	In _hydrate, stable adjacent-swap promoting B above A when BOTH have fts_rank and B.fts_rank strictly < A.fts_rank AND rrf gap abs(A.rrf-B.rrf) <= EPS*A.rrf; swept EPS in [0.05,0.10]. delta=0; no gold sat inside the EPS band at any tested value.
2	entity_overlap_boost	0.6063	-0.0081	0.6515	0.5009	212.5	0	discarded	discard	In _hydrate (hybrid.py), replace the binary boost_entities allowlist multiply with a proportional overlap boost: score *= 1 + (overlap_count / query_entity_count) * (boost_factor - 1). Gated to queries with 2+ parsed entities. delta=-0.0081; quality dropped from 0.6144 to 0.6063. DO NOT REVISIT.
2	no_en_concept_synonym_groups	0.6144	0	0.6667	0.4924	150.7	0	no_gain	discard	Add curated NO/EN concept-level synonym groups to retrieve.synonyms config (e.g. deployment/utrulling/produksjonssetting, standup/daglig møte, SAR/search and rescue). Feeds through existing load_synonym_groups / expand_fts_tokens path. delta=0; quality unchanged at 0.6144. DO NOT REVISIT.
2	tier2_factual_coverage_recovery_occurrence_gate	0.6144	0	0.6667	0.4924	187.6	0	discarded	discard	Extend kept tier2_factual_coverage_recovery credit (hybrid.py _hydrate_item) from query_shape==factual to also fire for query_shape==occurrence. Smallest diff: add "or cfg.query_shape == occurrence" to the existing condition. delta=0; quality unchanged at 0.6144. DO NOT REVISIT.
